title,website_url,source,grades_or_ages,prices_mentioned,description
1st Grade Launch Pack,https://aop.com/products/lifepac-1st-grade-launch-pack-lp1,Alpha Omega Publications,Grades K-5; Grades Pre-K-2; 1St Grade; K,$30.00,"The LIFEPAC ® 1st Grade Launch Pack from AOP is a great resource to support learning as your child goes through LIFEPAC ® 's 1st Grade coursework. While the “Materials Needed” and “Activities” sections of the lesson plans in the LIFEPAC ® teacher's guides provide numerous opportunities to use your resources, the Launch"
1st Grade Science Lab Kit,https://aop.com/products/lifepac-science-lab-kit-aokit0100,Alpha Omega Publications,Grades K-5; Grades Pre-K-2; 1St Grade; Ages 12; K,$42.95,"The 1st Grade Science Lab Kit from Home Science Tools contains the 11 most commonly ordered items for completing most activities in the LIFEPAC® 1st Grade Science Curriculum. Materials help you complete activities throughout the year that teach students about their senses, energy, plants, and more. Lab Kit Contents Mag"
"20,000 Leagues Under the Sea",https://aop.com/products/lifepac-20000-leagues-under-the-sea-lr0909,Alpha Omega Publications,Grades 11-12; Grades 6-8; Grades 9-10; Grades 9-12; Grade 9; 9Th Grade,$5.95,"Awaken your child's imagination and revive their love of reading with the gripping science fiction novel, 20,000 Leagues Under the Sea . Set in the 1800s, this classic novel follows the narration of Professor Pierre Aronnax and his expedition in search of a dangerous sea monster sited by several nations. After leaving "
20th Century American History,https://aop.com/products/monarch-20th-century-american-history-montcah-1,Alpha Omega Publications,Grades 11-12; Grades 9-10; Grades 9-12,$109.95,"Monarch 20th Century American History is a semester-long, online Christian homeschool elective that examines the key events and themes that influenced the United States from the early 1900s through the end of the century. Students explore topics such as World War I and II, the Great Depression, the Cold War, the civil "
20th Century American History Monthly,https://aop.com/products/monarch-20th-century-american-history-montcah-2,Alpha Omega Publications,Grades 11-12; Grades 9-10; Grades 9-12,$10.95,"Monarch 20th Century American History is a semester-long, online Christian homeschool elective that examines the key events and themes that influenced the United States from the early 1900s through the end of the century. Students explore topics such as World War I and II, the Great Depression, the Cold War, the civil "
2nd Grade Launch Pack,https://aop.com/products/lifepac-2nd-grade-launch-pack-lp2,Alpha Omega Publications,Grades K-5; Grades Pre-K-2; 2Nd Grade; K,$30.00,"The LIFEPAC ® 2nd Grade Launch Pack from AOP is a great resource to support learning as your child goes through LIFEPAC ® 's 2nd Grade coursework. While the “Materials Needed” and “Activities” sections of the lesson plans in the LIFEPAC ® teacher's guides provide numerous opportunities to use your resources, the Launch"
2nd Grade Science Lab Kit,https://aop.com/products/lifepac-science-lab-kit-aokit0200,Alpha Omega Publications,Grades K-5; Grades Pre-K-2; 2Nd Grade; Ages 12; K,$67.95,"The 2nd Grade Science Lab Kit from Home Science Tools contains the eight most commonly ordered items for completing most activities in the LIFEPAC® 2nd Grade Science curriculum. Materials help you complete activities throughout the year that teach students about the life cycle of sea monkeys, plant growth, the gift of "
3-5th Grade PE Teacher's Guide,https://aop.com/products/horizons-3rd5th-grade-pe-teachers-guide-jpe005,Alpha Omega Publications,Grades K-5; Grades 3-5; 5Th Grade; 3Rd Grade; 4Th Grade,$51.25,Strengthen your child's mind and their muscles with Horizons 3rd-5th Grade PE! The Horizons 3rd-5th Grade Physical Education Teacher's Guide is a robust resource for parents that develops students' motor skills and teaches healthy living practices. This homeschool curriculum teaches healthy living from a Christian pers
3rd Grade Science Lab Kit,https://aop.com/products/lifepac-science-lab-kit-aokit0300,Alpha Omega Publications,Grades K-5; Grades 3-5; 3Rd Grade; Ages 12,$61.95,"The 3rd Grade Science Lab Kit from Home Science Tools contains the 17 most commonly ordered items for completing most activities in the LIFEPAC® 3rd Grade Science curriculum. These materials help you complete activities throughout the year that teach students about plant growth, the gift of sound, and more. Lab Kit Con"
4th Grade Science Lab Kit,https://aop.com/products/lifepac-science-lab-kit-aokit0400,Alpha Omega Publications,Grades K-5; Grades 3-5; 4Th Grade; Ages 12,$74.95,"The 4th Grade Science Lab Kit from Home Science Tools contains the 18 most commonly ordered items for completing most activities in the LIFEPAC® 4th Grade Science curriculum. These non-household materials help you complete activities throughout the year that teach students about electricity and magnetism, the advantage"
5th Grade Science Lab Kit,https://aop.com/products/lifepac-science-lab-kit-aokit0500,Alpha Omega Publications,Grades K-5; Grades 3-5; 5Th Grade; Ages 12,$84.95,"The 5th Grade Science Lab Kit from Home Science Tools contains the 19 most commonly ordered items for completing most activities in the LIFEPAC® 5th Grade Science Curriculum. Materials help you complete activities throughout the year that teach students about skin cells, blood cells, liquid volume, evaporation, and mor"
6-8th Grade PE Teacher's Guide,https://aop.com/products/horizons-6th8th-grade-pe-teachers-guide-jpe008,Alpha Omega Publications,Grades 6-8; 8Th Grade; 6Rd Grade; 7Th Grade,$51.25,"Get your child moving and exercising with the activity-packed Horizons 6th-8th Grade PE! The Horizons 6th-8th Grade Physical Education Teacher's Guide. This homeschool curriculum is a robust resource for parents that teaches game rules and techniques for team, recreational, and intramural activities. Divided into secti"
6th Grade Science Lab Kit,https://aop.com/products/lifepac-science-lab-kit-aokit0600,Alpha Omega Publications,Grades 6-8; 6Th Grade; Ages 12,$124.95,"The 6th Grade Science Lab Kit from Home Science Tools contains the 26 most commonly ordered items for completing most activities in the LIFEPAC® 6th Grade Science curriculum. Materials help you complete activities throughout the year that teach students about photosynthesis, natural plant regulation, digestive enzymes,"
9-12th Grade PE Teacher's Guide,https://aop.com/products/horizons-9th12th-grade-pe-teachers-guide-jpe012,Alpha Omega Publications,Grades 11-12; Grades 9-10; Grades 9-12; 12Th Grade; 9Th Grade; 10Th Grade; 11Th Grade,$51.25,Teach your child responsible living and athletic discipline with Horizons 9th-12th Grade PE! The Horizons 9th-12th Grade Physical Education Teacher's Guide is a robust resource for homeschool parents that includes everything you need to teach physical education. Integrating a Christian perspective throughout lesson pla
A/V Technology and Film Careers,https://aop.com/products/monarch-av-technology-and-film-careers-montfc-1,Alpha Omega Publications,Careers For Grades 6+; Grades 11-12; Grades 9-10; Grades 9-12; Grades 6,$109.95,"Monarch A/V Technology and Film Careers is a semester-long, online Christian homeschool elective that explores career paths in the dynamic world of audio/visual technology and film. Students learn about the history of media production, the evolution of digital tools, and the variety of jobs in broadcasting, filmmaking,"
A/V Technology and Film Careers Monthly,https://aop.com/products/monarch-av-technology-and-film-careers-montfc-2,Alpha Omega Publications,Careers For Grades 6+; Grades 11-12; Grades 9-10; Grades 9-12; Grades 6,$10.95,"Monarch A/V Technology and Film Careers is a semester-long, online Christian homeschool elective that explores career paths in the dynamic world of audio/visual technology and film. Students learn about the history of media production, the evolution of digital tools, and the variety of jobs in broadcasting, filmmaking,"
Accounting Box Set,https://aop.com/products/lifepac-accounting-box-set-es9315,Alpha Omega Publications,Grades 11-12; Grades 6-8; Grades 9-10; Grades 9-12; Grades 7-12,$108.00,"Equip your child with practical mathematics skills for life and career with the LIFEPAC® Accounting Box Set for grades 7-12! This homeschool curriculum includes 10 student books and a teacher's guide. With frequent reviews to ensure your student will master all concepts, the LIFEPAC® Accounting Box Set is a wonderful h"
Accounting Student Grade Set,https://aop.com/products/lifepac-accounting-student-grade-set-es9300,Alpha Omega Publications,Grades 11-12; Grades 6-8; Grades 9-10; Grades 9-12; Grades 7-12,$102.00,"Equip your child with practical mathematics skills for life and career with the LIFEPAC® Accounting Student Grade Set for grades 7-12! This homeschool curriculum includes 10 student books. With frequent reviews to ensure your student will master all concepts, the LIFEPAC® Accounting Student Grade Set is a wonderful hom"
Accounting Teacher's Guide,https://aop.com/products/lifepac-accounting-teachers-guide-eh9300,Alpha Omega Publications,Grades 11-12; Grades 6-8; Grades 9-10; Grades 9-12,$26.75,"The LIFEPAC ® Accounting Teacher's Guide is a comprehensive resource for parents that includes everything you need to successfully support your student through the LIFEPAC ® Accounting electives course. This helpful resource includes answer keys for lesson questions, self tests, and unit tests for all student books, as"
Accounting Unit 1 Student Book,https://aop.com/products/lifepac-accounting-unit-1-student-book-el9301,Alpha Omega Publications,Grades 11-12; Grades 6-8; Grades 9-10; Grades 9-12,$11.50,"Practical and easy-to-follow, the LIFEPAC ® Accounting Unit 1 Student Book introduces accounting terms and concepts, the types of business ownership, and the accounting system. Additional applicable topics include the accounting equation, transactions, and plenty of review and application problems too. Topics in this A"
Accounting Unit 10 Student Book,https://aop.com/products/lifepac-accounting-unit-10-student-book-el9310,Alpha Omega Publications,Grades 11-12; Grades 6-8; Grades 9-10; Grades 9-12,$11.50,"Practical and easy-to-follow, the LIFEPAC ® Accounting Unit 10 Student Book teaches and reviews accounting terms and concepts, the types of business ownership, and the accounting system. Topics in this AOP curriculum include a comprehensive review of the accounting cycle covered in lessons of Units 1 through 9. The Acc"
Accounting Unit 2 Student Book,https://aop.com/products/lifepac-accounting-unit-2-student-book-el9302,Alpha Omega Publications,Grades 11-12; Grades 6-8; Grades 9-10; Grades 9-12,$11.50,"Practical and easy-to-follow, the LIFEPAC ® Accounting Unit 2 Student Book teaches and reviews accounting terms and concepts, the types of business ownership, and the accounting system. Topics in this AOP curriculum include creating a chart of accounts, financial reporting, and opening entries, also introducing your st"
Accounting Unit 3 Student Book,https://aop.com/products/lifepac-accounting-unit-3-student-book-el9303,Alpha Omega Publications,Grades 11-12; Grades 6-8; Grades 9-10; Grades 9-12,$11.50,"Practical and easy-to-follow, the LIFEPAC ® Accounting Unit 3 Student Book teaches and reviews accounting terms and concepts, the types of business ownership, and the accounting system. Topics in this AOP curriculum include the importance of analyzing and journalizing transactions. Step-by-step topics include using the"
Accounting Unit 4 Student Book,https://aop.com/products/lifepac-accounting-unit-4-student-book-el9304,Alpha Omega Publications,Grades 11-12; Grades 6-8; Grades 9-10; Grades 9-12,$11.50,"Practical and easy-to-follow, the LIFEPAC ® Accounting Unit 4 Student Book teaches and reviews accounting terms and concepts, the types of business ownership, and the accounting system. Topics in this AOP curriculum include a comprehensive study of posting to the general ledger, helping to teach your student ledger acc"
Accounting Unit 5 Student Book,https://aop.com/products/lifepac-accounting-unit-5-student-book-el9305,Alpha Omega Publications,Grades 11-12; Grades 6-8; Grades 9-10; Grades 9-12,$11.50,"Practical and easy-to-follow, the LIFEPAC ® Accounting Unit 5 Student Book teaches and reviews accounting terms and concepts, the types of business ownership, and the accounting system. Topics in this AOP curriculum include headings and account titles, trial balances, balance sheets, income statements, and calculating "
Accounting Unit 6 Student Book,https://aop.com/products/lifepac-accounting-unit-6-student-book-el9306,Alpha Omega Publications,Grades 11-12; Grades 6-8; Grades 9-10; Grades 9-12,$11.50,"Practical and easy-to-follow, the LIFEPAC ® Accounting Unit 6 Student Book teaches and reviews accounting terms and concepts, the types of business ownership, and the accounting system. Topics in this AOP curriculum include guidance through each section of the income statement, the owner's equity statement, and the bal"
Accounting Unit 7 Student Book,https://aop.com/products/lifepac-accounting-unit-7-student-book-el9307,Alpha Omega Publications,Grades 11-12; Grades 6-8; Grades 9-10; Grades 9-12,$11.50,"Practical and easy-to-follow, the LIFEPAC ® Accounting Unit 7 Student Book teaches and reviews accounting terms and concepts, the types of business ownership, and the accounting system. Topics in this AOP curriculum include how to create adjusting and closing entries and how to post these entries to the general ledger,"
Accounting Unit 8 Student Book,https://aop.com/products/lifepac-accounting-unit-8-student-book-el9308,Alpha Omega Publications,Grades 11-12; Grades 6-8; Grades 9-10; Grades 9-12,$11.50,"Practical and easy-to-follow, the LIFEPAC ® Accounting Unit 8 Student Book teaches and reviews accounting terms and concepts, the types of business ownership, and the accounting system. Topics in this AOP curriculum include payroll functions, mandatory and voluntary deductions, employer taxes, calculating employee earn"
Accounting Unit 9 Student Book,https://aop.com/products/lifepac-accounting-unit-9-student-book-el9309,Alpha Omega Publications,Grades 11-12; Grades 6-8; Grades 9-10; Grades 9-12,$11.50,"Practical and easy-to-follow, the LIFEPAC ® Accounting Unit 9 Student Book teaches and reviews accounting terms and concepts, the types of business ownership, and the accounting system. Topics in this AOP curriculum include analyzing and recording payroll transactions, determining employer payroll taxes, studying FICA "
ACT Test Prep,https://aop.com/products/monarch-act-test-prep-monatp-1,Alpha Omega Publications,Grades 11-12; Grades 9-10; Grades 9-12,$109.95,"Monarch ACT Test Prep is a semester-long, online Christian homeschool elective that helps students prepare for the ACT exam through targeted instruction in English, math, reading, and science. Lessons also include writing strategies and sample essay practice for the optional writing test. The course provides practice q"
ACT Test Prep Monthly,https://aop.com/products/monarch-act-test-prep-monatp-2,Alpha Omega Publications,Grades 11-12; Grades 9-10; Grades 9-12,$10.95,"Monarch ACT Test Prep is a semester-long, online Christian homeschool elective that helps students prepare for the ACT exam through targeted instruction in English, math, reading, and science. Lessons also include writing strategies and sample essay practice for the optional writing test. The course provides practice q"
Additional Student Full Access Monthly Subscription,https://aop.com/products/monarch-addl-all-access-monthly,Alpha Omega Publications,Grades K-5; Grades 11-12; Grades 3-5; Grades 6-8; Grades 9-10; Grades 9-12; Grades 3–12,$19.95,"Give your child a flexible, faith-focused education with a Monarch Full Access Monthly Subscription for additional students. With just one subscription, you unlock unlimited access to over 100 online courses in Bible, History & Geography, Language Arts, Math, and Science for grades 3–12—plus a growing catalog of electi"
Additional Student Full Access Yearly Subscription,https://aop.com/products/monarch-addl-all-access-yearly,Alpha Omega Publications,Grades K-5; Grades 11-12; Grades 3-5; Grades 6-8; Grades 9-10; Grades 9-12; Grades 3–12,$199.95,"Give your child a flexible, faith-focused education with a Monarch Full Access Yearly Subscription. With just one subscription, you unlock unlimited access to over 100 online courses in Bible, History & Geography, Language Arts, Math, and Science for grades 3–12—plus a growing catalog of electives. Whether you're setti"
Algebra I,https://aop.com/products/monarch-algebra-i-mon900m-1,Alpha Omega Publications,Grades 9-10; Grades 9-12,$109.95,"Monarch Algebra I is a full-year, online Christian homeschool course that builds foundational algebra skills through solving equations, graphing functions, and analyzing real-world problems. Topics include linear equations, inequalities, polynomials, quadratic functions, rational expressions, and systems of equations. "
Algebra I Box Set,https://aop.com/products/lifepac-algebra-i-box-set-mat0915,Alpha Omega Publications,Grades 9-10; Grades 9-12; 9Th Grade; Grades K-5,$108.00,"Extend your child’s learning beyond the fundamentals and into advanced math with the LIFEPAC® 9th Grade Algebra I Box Set! This set includes 10 student books and a teacher's guide, providing a full year of homeschool lessons. Using the mastery-based teaching and learning approach, LIFEPAC® Math is designed to build cum"
Algebra I Box Set,https://aop.com/products/horizons-algebra-i-box-set-jmc800,Alpha Omega Publications,Grades 6-8; 8Th Grade,$120.00,"Give your homeschool child a smooth transition into advanced mathematics with the Horizons Algebra I Box Set for 8th grade. With 160 lessons, this easy-to-use AOP curriculum includes a student workbook, teacher’s guide, and test & resources book. Horizons Algebra I curriculum provides comprehensive instruction on topic"
Algebra I Monthly,https://aop.com/products/monarch-algebra-i-mon900m-2,Alpha Omega Publications,Grades 9-10; Grades 9-12,$10.95,"Monarch Algebra I is a full-year, online Christian homeschool course that builds foundational algebra skills through solving equations, graphing functions, and analyzing real-world problems. Topics include linear equations, inequalities, polynomials, quadratic functions, rational expressions, and systems of equations. "
Algebra I Student Book,https://aop.com/products/horizons-algebra-i-student-book-jms081,Alpha Omega Publications,Grades 6-8; 8Th Grade,$50.00,"Prepare your child for advanced math studies with Horizons' comprehensive Algebra I curriculum! With diverse, skill-building activities in 160 lessons, the Horizons 8th Grade Algebra I Student Book is designed to ensure your student thoroughly understands and retains all lesson concepts. Based on the spiral-learning me"
Algebra I Student Grade Set,https://aop.com/products/lifepac-algebra-i-student-grade-set-mat0900,Alpha Omega Publications,Grades 9-10; Grades 9-12; 9Th Grade; Grades K-5,$102.00,"Extend your child’s learning beyond the fundamentals and into advanced math with the LIFEPAC® 9th Grade Algebra I Student Grade Set! This set includes 10 student books, providing a full year of homeschool lessons. Using the mastery-based teaching and learning approach, LIFEPAC® Math is designed to build cumulative math"
Algebra I Teacher's Guide,https://aop.com/products/lifepac-algebra-i-teachers-guide-mat0920,Alpha Omega Publications,Grades 9-10; Grades 9-12,$26.75,"The LIFEPAC ® Algebra I Teacher's Guide is a comprehensive, step-by-step resource for parents that includes everything you need to successfully guide your child through LIFEPAC ® Algebra I. This helpful resource is filled with clear explanations and easy-to-follow materials, including a LIFEPAC ® curriculum overview, a"
Algebra I Teacher's Guide,https://aop.com/products/horizons-algebra-i-teachers-guide-jmt080,Alpha Omega Publications,Grades 6-8; 8Th Grade,$50.00,"Prepare your child for advanced math studies with the Horizons 8th Grade Algebra I Teacher's Guide! A robust resource for homeschool parents, the teacher's guide includes everything you need to give your child a high-quality homeschool math education. Based on the spiral-learning method, this AOP curriculum continually"
Algebra I Tests & Resources Book,https://aop.com/products/horizons-algebra-i-tests-resources-book-jmr080,Alpha Omega Publications,Grades 6-8; 8Th Grade,$31.25,"Evaluate and elevate your child's math skills comprehension with the Horizons 8th Grade Algebra I Test and Resources Book! This extensive resource includes 80 review worksheets, 16 tests, four exams, and additional hands-on activity ideas. Designed to align with Horizons 8th Grade Algebra I curriculum, this AOP resourc"
Algebra I Unit 1 Student Book,https://aop.com/products/lifepac-algebra-i-unit-1-student-book-mat0901,Alpha Omega Publications,Grades 9-10; Grades 9-12,$11.50,"The LIFEPAC ® Algebra I Unit 1 Student Book includes step-by-step instructions and helpful guidelines to encourage student learning. LIFEPAC ® Math Student Books include Bible-based activities designed to build the important math skills your child needs to understand future concepts. The Algebra I Unit 1 Student Book, "
Algebra I Unit 10 Student Book,https://aop.com/products/lifepac-algebra-i-unit-10-student-book-mat0910,Alpha Omega Publications,Grades 9-10; Grades 9-12,$11.50,The LIFEPAC ® Algebra I Unit 10 Student Book includes step-by-step instructions and helpful guidelines to encourage student learning. LIFEPAC ® Math Student Books include Bible-based activities designed to build the important math skills your child needs to understand future concepts. The Algebra I Unit 10 Student Book
Algebra I Unit 2 Student Book,https://aop.com/products/lifepac-algebra-i-unit-2-student-book-mat0902,Alpha Omega Publications,Grades 9-10; Grades 9-12,$11.50,"The LIFEPAC ® Algebra I Unit 2 Student Book includes step-by-step instructions and helpful guidelines to encourage student learning. LIFEPAC ® Math Student Books include Bible-based activities designed to build the important math skills your child needs to understand future concepts. The Algebra I Unit 2 Student Book, "
Algebra I Unit 3 Student Book,https://aop.com/products/lifepac-algebra-i-unit-3-student-book-mat0903,Alpha Omega Publications,Grades 9-10; Grades 9-12,$11.50,"The LIFEPAC ® Algebra I Unit 3 Student Book includes step-by-step instructions and helpful guidelines to encourage student learning. LIFEPAC ® Math Student Books include Bible-based activities designed to build the important math skills your child needs to understand future concepts. The Algebra I Unit 3 Student Book, "
Algebra I Unit 4 Student Book,https://aop.com/products/lifepac-algebra-i-unit-4-student-book-mat0904,Alpha Omega Publications,Grades 9-10; Grades 9-12,$11.50,"The LIFEPAC ® Algebra I Unit 4 Student Book includes step-by-step instructions and helpful guidelines to encourage student learning. LIFEPAC ® Math Student Books include Bible-based activities designed to build the important math skills your child needs to understand future concepts. The Algebra I Unit 4 Student Book, "
Algebra I Unit 5 Student Book,https://aop.com/products/lifepac-algebra-i-unit-5-student-book-mat0905,Alpha Omega Publications,Grades 9-10; Grades 9-12,$11.50,"The LIFEPAC ® Algebra I Unit 5 Student Book includes step-by-step instructions and helpful guidelines to encourage student learning. LIFEPAC ® Math Student Books include Bible-based activities designed to build the important math skills your child needs to understand future concepts. The Algebra I Unit 5 Student Book, "
Algebra I Unit 6 Student Book,https://aop.com/products/lifepac-algebra-i-unit-6-student-book-mat0906,Alpha Omega Publications,Grades 9-10; Grades 9-12,$11.50,"The LIFEPAC ® Algebra I Unit 6 Student Book includes step-by-step instructions and helpful guidelines to encourage student learning. LIFEPAC ® Math Student Books include Bible-based activities designed to build the important math skills your child needs to understand future concepts. The Algebra I Unit 6 Student Book, "
Algebra I Unit 7 Student Book,https://aop.com/products/lifepac-algebra-i-unit-7-student-book-mat0907,Alpha Omega Publications,Grades 9-10; Grades 9-12,$11.50,"The LIFEPAC ® Algebra I Unit 7 Student Book includes step-by-step instructions and helpful guidelines to encourage student learning. LIFEPAC ® Math Student Books include Bible-based activities designed to build the important math skills your child needs to understand future concepts. The Algebra I Unit 7 Student Book, "
Algebra I Unit 8 Student Book,https://aop.com/products/lifepac-algebra-i-unit-8-student-book-mat0908,Alpha Omega Publications,Grades 9-10; Grades 9-12,$11.50,"The LIFEPAC ® Algebra I Unit 8 Student Book includes step-by-step instructions and helpful guidelines to encourage student learning. LIFEPAC ® Math Student Books include Bible-based activities designed to build the important math skills your child needs to understand future concepts. The Algebra I Unit 8 Student Book, "
Algebra I Unit 9 Student Book,https://aop.com/products/lifepac-algebra-i-unit-9-student-book-mat0909,Alpha Omega Publications,Grades 9-10; Grades 9-12,$11.50,"The LIFEPAC ® Algebra I Unit 9 Student Book includes step-by-step instructions and helpful guidelines to encourage student learning. LIFEPAC ® Math Student Books include Bible-based activities designed to build the important math skills your child needs to understand future concepts. The Algebra I Unit 9 Student Book, "
