title,website_url,homeschool_com_url,grades_or_ages,prices_mentioned,description
ScoreBeyond,http://www.rea.com,https://www.homeschool.com/resource-guide/scorebeyond/,Kindergarten; 1st Grade; 2nd Grade; 3rd Grade; 4th Grade; 5th Grade; 6th Grade; 7th Grade; 8th Grade; 9th Grade; 10th Grade; 11th Grade; 12th Grade,$5-$50,"ScoreBeyond combines real-time student data with expert tutors to deliver personalized SAT & ACT tutoring. No matter what your SAT & ACT goals are, ScoreBeyond can help create a test prep program that's right"
Middlebury Interactive Languages,https://shop.middleburyinteractive.com/?utm_source=HomeschoolDOTcom&utm_medium=Listing&utm_campaign=Listing,https://www.homeschool.com/resource-guide/middlebury-interactive-languages/,Kindergarten; 1st Grade; 2nd Grade; 3rd Grade; 4th Grade; 5th Grade; 6th Grade; 7th Grade; 8th Grade; 9th Grade; 10th Grade; 11th Grade; 12th Grade,$119-$344,"You don't need to know a foreign language to start your child on the course to bilingualism. Middlebury Interactive's immersive K-12 world language courses in Spanish, French, Chinese and German guide students in a"
Beautiful Feet Books,http://www.bfbooks.com,https://www.homeschool.com/resource-guide/beautiful-feet-books/,Kindergarten; 1st Grade; 2nd Grade; 3rd Grade; 4th Grade; 5th Grade; 6th Grade; 7th Grade; 8th Grade; 9th Grade; 10th Grade; 11th Grade; 12th Grade,$10-$300,"Beautiful Feet Books believes great literature has the power to unlock history and make it come alive for students. Thus, they are dedicated to offering parents history programs with the best literature available, study"
Home Learning Institiute,https://homelearninginstitute.com/,https://www.homeschool.com/resource-guide/home-learning-institiute/,Pre-K - 12th Grade,$29.95/month or $249.95/year,"Home Learning Institute is an affordable, all-in-one online curriculum option for homeschoolers. Grades 1st-12th are offered with courses specific to each level. This self-paced program is a good option for any learning"
Kingdom Games,http://www.kingdomgames.com,https://www.homeschool.com/resource-guide/kingdom-games/,3rd Grade; 4th Grade; 5th Grade; 6th Grade; 7th Grade; 8th Grade; 9th Grade; 10th Grade; 11th Grade; 12th Grade,$6-$17,"Kingdom Games features educational video games for Christians. Students learn Biblical concepts through immersive story playing with this interactive curriculum. In faith-based stories, students will play the part of"
Monarch Homeschool Curriculum,https://www.aop.com/curriculum/monarch?utm_source=homeschoolcom&utm_medium=weblisting&utm_content=2020monarch&utm_campaign=2020hsc,https://www.homeschool.com/resource-guide/monarch/,Kindergarten; 1st Grade; 2nd Grade; 3rd Grade; 4th Grade; 5th Grade; 6th Grade; 7th Grade; 8th Grade; 9th Grade; 10th Grade; 11th Grade; 12th Grade,$39.95/mo-$69.95/mo,"Enjoy the freedom of online learning! With automatic grading, convenient recordkeeping, and dynamic, media-rich lessons for grades K-12, it’s no wonder that parents and students love homeschooling with Monarch. Plus,"
The Lost Tools of Writing,https://www.circeinstitute.org/lost-tools-writing,https://www.homeschool.com/resource-guide/the-lost-tools-of-writing/,6th Grade; 7th Grade; 8th Grade; 9th Grade; 10th Grade; 11th Grade; 12th Grade,$25-$157,"Discover a treasure chest of resources used by teachers around the world to cultivate wisdom and virtue through writing. Here you will find tools to remove the guesswork, anxiety, and frustration felt by so many student"
Math-U-See,https://www.mathusee.com/,https://www.homeschool.com/resource-guide/math-u-see/,Kindergarten; 1st Grade; 2nd Grade; 3rd Grade; 4th Grade; 5th Grade; 6th Grade; 7th Grade; 8th Grade; 9th Grade; 10th Grade; 11th Grade; 12th Grade,$100-$500,"Math-U-See is a complete K-12 math program with a unique instructional approach that uses a distinctive set of manipulatives and strategies, presented through videos and textbooks, to help students master math concepts"
Global Student Network,https://globalstudentnetwork.com,https://www.homeschool.com/resource-guide/global-student-network/,Kindergarten; 1st Grade; 2nd Grade; 3rd Grade; 4th Grade; 5th Grade; 6th Grade; 7th Grade; 8th Grade; 9th Grade; 10th Grade; 11th Grade; 12th Grade,varies,"Global Student Network provides online curriculum for grades K-12. By using Global Student Network, your child will receive an accredited education, ensuring the highest standards are met. Parents have the ability to"
Christian Liberty Press,http://christianliberty.com,https://www.homeschool.com/resource-guide/christian-liberty-press/,Pre-K - 12th Grade,$5-$800,"Christian Liberty Press is the publishing arm of the nationally recognized Christian Liberty Academy, and offers independent home educators a wide variety of quality textbooks and educational materials at discount"
Timberdoodle,https://timberdoodle.com,https://www.homeschool.com/resource-guide/timberdoodle/,,One-Time Payment (Materials),Engages the hands-on learner and encourages a growing love for learning. We stress critical thinking skills and rely on independent learning.
Big Brains Education,http://bigbrainseducation.com/,https://www.homeschool.com/resource-guide/big-brains-education/,9th Grade; 10th Grade; 11th Grade; 12th Grade,Price Varies,Big Brains Education offers personalized and effective tutoring and college admissions counseling services in Redmond.
Kid Flix,https://www.kidflixglobal.com/,https://www.homeschool.com/resource-guide/kid-flix/,2nd Grade; 3rd Grade; 4th Grade; 5th Grade; 6th Grade; 7th Grade; 8th Grade; 9th Grade; 10th Grade; 11th Grade; 12th Grade,$1,Award Winning Films from around the world for kids & families
Progressive Phonics,https://www.progressivephonics.com/,https://www.homeschool.com/resource-guide/progressive-phonics/,Kindergarten; 1st Grade; 2nd Grade; 3rd Grade; 4th Grade; 5th Grade,Free,"Progressive Phonics is an all-in-one reading program that is easy, fun, and totally FREE! With Progressive Phonics, ANYONE can teach a child to read and write in just a few minutes a day. The program includes: No"
Tiers Free Academy,http://www.tiersfreeacademy.org,https://www.homeschool.com/resource-guide/tiers-free-academy/,Pre-K - 12th Grade,$100-$300 per class,"Tiers Free Online Curriculum offers a flexible, comprehensive, and personalized approach to education for middle and high school students, using a blend of modern learning tools to cater to diverse learning needs. For"
Brave Writer,https://bravewriter.com/,https://www.homeschool.com/resource-guide/brave-writer/,Kindergarten; 1st Grade; 2nd Grade; 3rd Grade; 4th Grade; 5th Grade; 6th Grade; 7th Grade; 8th Grade; 9th Grade; 10th Grade; 11th Grade; 12th Grade,Varies,"""Help your child fall in love with writing! Through our user-friendly materials and award-winning online classes, you'll grow into a competent writing coach, calm your anxious writers, and nourish your aspiring"
Murray’s Technical Education,http://www.homeschoolingus.com/,https://www.homeschool.com/resource-guide/murrays-technical-education/,9th Grade; 10th Grade; 11th Grade; 12th Grade,One-Time Payment (Materials),"Drafting I – Mechanical and Fundamentals, Drafting II – Architectural, Drafting III – 3-D modeling courses."
NiHongo Master,https://www.nihongomaster.com/,https://www.homeschool.com/resource-guide/nihongo-master/,7th Grade; 8th Grade; 9th Grade; 10th Grade; 11th Grade; 12th Grade,$1,"Join over 50,000 Japanese students in your learning journey. Get assistance from others and our Japanese instructors quickly. In five minutes you can start learning how to read, write and speak Japanese with lessons"
Waldorf Essentials Online Curriculum,https://melisa-nielsen.mykajabi.com/,https://www.homeschool.com/resource-guide/waldorf-essentials-online-curriculum/,Kindergarten; 1st Grade; 2nd Grade; 3rd Grade; 4th Grade; 5th Grade; 6th Grade; 7th Grade; 8th Grade; 9th Grade,Starting at $12,"Waldorf Essentials helps combine the Waldorf curriculum with the flexibility of homeschooling for an individualized, freeing education for children in elementary and middle school. Waldorf Essentials offers resources to"
Joyfulnotes Piano for Beginners,https://joyfulnotespiano.thinkific.com/pages/homeschool-com-gift-guide-recipients,https://www.homeschool.com/resource-guide/joyfulnotes-piano-for-beginners/,Preschool; Kindergarten; 1st Grade; 2nd Grade; 3rd Grade; 4th Grade,"$15/book, $30/month course, $20/month community",Joyfulnotes creates piano books for kids using a color-coded line method. All piano books are written from a Christian perspective. Joyfulnotes also has an online course teaching our books using animated stories
Heart of Dakota,https://www.heartofdakota.com/,https://www.homeschool.com/resource-guide/heart-of-dakota/,Pre-K - 12th Grade,Varies,"""Heart of Dakota publishes a Christian homeschool curriculum that is easy to use, flexible, educational and can also be used with multiple ages at the same time. Our desire is to help homeschool teachers have a"
Seton Home Study School,https://www.setonhome.org/,https://www.homeschool.com/resource-guide/seton-home-study-school/,Pre-K - 12th Grade,varies by grade,"Seton is an accredited school assisting homeschooling parents by providing an academically excellent and authentically Catholic curriculum. Seton Home Study School provides a Christ-centered, academically strong program"
Wildwood Homeschool Curriculum,https://wildwoodcurriculum.com/,https://www.homeschool.com/resource-guide/wildwood-homeschool-curriculum/,1st Grade; 2nd Grade; 3rd Grade; 4th Grade; 5th Grade; 6th Grade; 7th Grade; 8th Grade; 9th Grade,$1,Wildwood is a secular curriculum for ages 6-14 based on the Charlotte Mason method. It provides you with lists containing all the information you'll need to utilize this curriculum. They are currently adding to the
Spelling Power,https://www.thespellingpower.com/,https://www.homeschool.com/resource-guide/spelling-power/,Kindergarten; 1st Grade; 2nd Grade; 3rd Grade; 4th Grade; 5th Grade; 6th Grade; 7th Grade; 8th Grade; 9th Grade; 10th Grade; 11th Grade; 12th Grade,Varies,"""Spelling Power has everything you need to teach spelling words and skills to your entire family to the college level. With Spelling Power, your children will master the 5,000 most frequently used words and key"
Mathleaks,https://mathleaks.com/,https://www.homeschool.com/resource-guide/mathleaks/,7th Grade; 8th Grade; 9th Grade; 10th Grade; 11th Grade; 12th Grade,$1,"Textbook solutions and Mathleaks E-courses, all in one app. Integrated with our solutions, Mathleaks E-courses can be used as stand-alone curriculum or as a supplement to your textbook"
Catechism Class,https://www.catechismclass.com/,https://www.homeschool.com/resource-guide/catechism-class/,Kindergarten; 1st Grade; 2nd Grade; 3rd Grade; 4th Grade; 5th Grade; 6th Grade; 7th Grade; 8th Grade; 9th Grade; 10th Grade; 11th Grade; 12th Grade,varies,"From the website: ""As a homeschooling parent, you have options in your children's education. Look no further than CatechismClass.com, the producer of a first-of-its-kind online Catholic homeschooling curriculum. Founded"
Math by Hand Lesson Plans,http://mathbyhand.com/,https://www.homeschool.com/resource-guide/math-by-hand-lesson-plans/,1st Grade; 2nd Grade; 3rd Grade; 4th Grade,$20-$154,"Math By Hand is a Waldorf-inspired, hands-on, complete math curriculum for grades 1-4. We offer lesson plans and activities, plus all the materials you and your child need to create your own learning tools. You will"
Simply Charlotte Mason,https://simplycharlottemason.com/,https://www.homeschool.com/resource-guide/simply-charlotte-mason/,Pre-K - 12th Grade,varies,"Simply Charlotte Mason is a Biblically-based approach to learning with family-style lessons, open-and-go plans that align with Christian values. With a variety of topic and skill based subjects, your children are set up"
Draw to Learn,https://history.notgrass.com/,https://www.homeschool.com/resource-guide/draw-to-learn/,Kindergarten; 1st Grade; 2nd Grade; 3rd Grade; 4th Grade; 5th Grade; 6th Grade; 7th Grade; 8th Grade; 9th Grade; 10th Grade; 11th Grade; 12th Grade,One-Time Payment (Materials),"Draw to Learn is a homeschool art curriculum and Bible study series. Notgrass History exists to glorify God by producing materials centered in His Word that help parents train their children to honor God with heart,"
MasterBooks Science,http://www.masterbooks.com/,https://www.homeschool.com/resource-guide/masterbooks-curriculum-science/,3rd Grade; 4th Grade; 5th Grade; 6th Grade; 7th Grade; 8th Grade; 9th Grade; 10th Grade; 11th Grade; 12th Grade,$32-$92,"MasterBooks Science is designed for grades 3-12 & involves a variety of science subjects; anatomy & physiology, engineering, chemistry, elementary science, biology, etc. from a Biblical perspective. Includes"
Revolution Prep,https://www.revolutionprep.com/,https://www.homeschool.com/resource-guide/revolution-prep/,9th Grade; 10th Grade; 11th Grade; 12th Grade,$99-$1199,"Revolution Prep’s convenient online tutoring programs optimize the learning experience with personalized instruction, easy scheduling, and top-quality tutors – anywhere, at any time!"
Thinkster Math Tutoring,https://hellothinkster.com/,https://www.homeschool.com/resource-guide/thinkster-math-tutoring/,Kindergarten; 1st Grade; 2nd Grade; 3rd Grade; 4th Grade; 5th Grade; 6th Grade; 7th Grade; 8th Grade; 9th Grade; 10th Grade; 11th Grade; 12th Grade,Starting at $53/mo,Thinkster is an AI-driven tutoring & test prep company for children kindergarten through high school. They combine the power of elite human tutors with a world-class curriculum and amazing AI and data-driven
The Noland Kids Adventure Series,https://www.amazon.com/dp/B0B8XQQ6GT,https://www.homeschool.com/resource-guide/the-noland-kids-adventure-series/,8th Grade,$11.99,"Travel the world with the Noland kids on high adventures filled with mysterious clues. Join them in Florida, the Congo, Vietnam, and the Caribbean in their endeavors to help the hurting and bring truth to light."
Adulting University,http://www.adulting-university.com/curriculum,https://www.homeschool.com/resource-guide/adulting-university/,8th Grade; 9th Grade; 10th Grade; 11th Grade; 12th Grade,$7-$199,"At Adulting University, we provide a comprehensive curriculum tailored for Christian homeschoolers with teens, focusing on essential life skills, career development, and college readiness. Our curriculum offers a"
Rhythm and Writing,https://www.rhythmandwriting.com/,https://www.homeschool.com/resource-guide/rhythm-and-writing-homeschool-curriculum/,Preschool; Kindergarten; 1st Grade; 2nd Grade,$19.99 - $64.99,"Developed by an Occupational Therapist, Rhythm & Writing is the perfect handwriting curriculum for kids learning to write, kids who need extra help learning to write, and kids who just don’t like to write!!!"
Understanding 9/11,https://pallascenter.com/c/understanding-9-11/,https://www.homeschool.com/resource-guide/understanding-9-11/,8th Grade; 9th Grade; 10th Grade; 11th Grade; 12th Grade,Free to $99,Understanding 9/11 is a full credit history course designed specifically for teenaged homeschoolers. For families interested in an honest discussion about 9/11 -- rooted in real investigative journalism with minimal
Moving Beyond the Page,https://www.movingbeyondthepage.com/,https://www.homeschool.com/resource-guide/moving-beyond-the-page/,Pre-K - 12th Grade,$257-$983,"Your children will grow in their love of learning through our literature-based curriculum that encourages critical and creative thinking, provides challenging and engaging projects, and supports different"
Rod and Staff,https://www.milestonebooks.com/list/Building_Christian_English_Series/,https://www.homeschool.com/resource-guide/rod-and-staff/,Kindergarten; 1st Grade; 2nd Grade; 3rd Grade; 4th Grade; 5th Grade; 6th Grade; 7th Grade; 8th Grade; 9th Grade; 10th Grade,$1,"Rod and Staff English is a unique blend of grammar and composition (writing) that produces outstanding results. Add Spelling by Sound and Structure to build word power, and Rod and Staff's reading (literature) to"
Lavender’s Blue Homeschool Curriculum,https://www.lavendersbluehomeschool.com/,https://www.homeschool.com/resource-guide/lavenders-blue-homeschool-curriculum/,Kindergarten; 1st Grade; 2nd Grade; 3rd Grade; 4th Grade,$267-$297,"The Lavender’s Blue curriculum is a complete, creative, and highly detailed Waldorf curriculum. The curriculum uses a holistic homeschooling approach, focused on teaching children as whole, developing people."
Integrate,https://biologos.org/integrate,https://www.homeschool.com/resource-guide/integrate/,9th Grade; 10th Grade; 11th Grade; 12th Grade,$249.99,"Integrate is a faith & science curriculum that helps high students to explore theological and ethical questions raised by modern science, while cultivating virtues such as humility, wisdom, and wonder."
Scholastic,https://www.scholastic.com/home/,https://www.homeschool.com/resource-guide/scholastic/,1st Grade; 2nd Grade; 3rd Grade; 4th Grade; 5th Grade; 6th Grade; 7th Grade; 8th Grade; 9th Grade; 10th Grade; 11th Grade; 12th Grade,$.99-$299,"Scholastic is the world's largest publisher and distributor of children's books, connecting educators and families through accessibility, engagement, and expertise. We are a leading provider of literacy curriculum,"
Trail Guide to Learning,https://geomatters.com/pages/trail-guide-to-learning,https://www.homeschool.com/resource-guide/trail-guide-to-learning/,3rd Grade; 4th Grade; 5th Grade; 6th Grade; 7th Grade; 8th Grade,Varies,"""The Trail Guide to Learning series is a complete homeschool curriculum that teaches every subject except for math, using an integrated approach to develop thinking skills."""
MasterBooks: More Than Words,http://www.masterbooks.com/,https://www.homeschool.com/resource-guide/masterbooks-more-than-words/,Kindergarten; 1st Grade; 2nd Grade; 3rd Grade; 4th Grade; 5th Grade; 6th Grade,$30-$32,"More Than Words (1&2) is part of the Living Faith Curriculum Series. It is designed for grades K-3, but easy to adapt to multiple students at multiple levels. Full of stories, pages to color & draw, beautiful"
Miacademy,https://parents.miacademy.co/#/,https://www.homeschool.com/resource-guide/miacademy/,Kindergarten; 1st Grade; 2nd Grade; 3rd Grade; 4th Grade; 5th Grade; 6th Grade; 7th Grade; 8th Grade; 9th Grade; 10th Grade; 11th Grade; 12th Grade,$29.99 - $40.00 per month,"Miacademy offers hundreds of lessons in math, language arts, science, and social studies, covering all of K-8. In addition to the core subjects, Miacademy has a variety of electives from introductions to several"
A+ Interactive Math Online Courses,https://www.aplustutorsoft.com/Index.jsp,https://www.homeschool.com/resource-guide/a-interactive-math-online-courses/,1st Grade; 2nd Grade; 3rd Grade; 4th Grade; 5th Grade; 6th Grade; 7th Grade; 8th Grade; 9th Grade,$9.99/yr-$25.00,"A+ Interactive Math provides multi-sensory interactive math full curriculum products to help students improve their grades at all levels. Using a proprietary learning platform that combines voice, visual and text-based"
Let’s Go Geography,https://www.letsgogeography.com/,https://www.homeschool.com/resource-guide/lets-go-geography/,Kindergarten; 1st Grade; 2nd Grade; 3rd Grade; 4th Grade; 5th Grade; 6th Grade; 7th Grade; 8th Grade,$34.99,"Let’s Go Geography is like no other! Kids learn geography by exploring real countries & cultures around the globe with video, photos, & creative activities. Grades K-2 finish each lesson with coloring &"
Edoki Academy Montessori Preschool Online Curriculum,https://montessori.edokiacademy.com/en/about-us/,https://www.homeschool.com/resource-guide/edoki-academy-online-curriculum/,Preschool; Kindergarten,"$5.24/mo, $59/yr","Edoki produces high-quality, multilingual digital learning experiences for children taught with the Montessori homeschooling method. A subscription to Edoki provides access to over 30 apps that cover subjects from"
Homeschool Complete,https://www.homeschoolcomplete.com/?Click=2084,https://www.homeschool.com/resource-guide/homeschool-complete/,Preschool; Kindergarten; 1st Grade; 2nd Grade; 3rd Grade; 4th Grade; 5th Grade,varies,"Homeschool Complete is a parent-recommended, all-in-one program with fully planned lessons for all subjects. We truly had ‘simplicity’ in mind while developing this curriculum – no more switching manuals or"
ALEKS,https://www.homeschool.com/resource-guide/aleks/,https://www.homeschool.com/resource-guide/aleks/,3rd Grade; 4th Grade; 5th Grade; 6th Grade; 7th Grade; 8th Grade; 9th Grade; 10th Grade; 11th Grade; 12th Grade,$20/month,ALEKS offers online Math options for grades 3-12 with ongoing assessments. Pay a monthly fee and tailor it to your student's needs. Easy to monitor your student's progress from your master account.
Cross Seven Ventures,https://www.crossseven.org/,https://www.homeschool.com/resource-guide/cross-seven-ventures/,Kindergarten; 1st Grade; 2nd Grade; 3rd Grade; 4th Grade; 5th Grade; 6th Grade; 7th Grade; 8th Grade; 9th Grade; 10th Grade; 11th Grade; 12th Grade,$11/mo,"Cross Seven has developed videos you can subscribe to based on the Claritas Publishing curriculum which helps brain development and memorization. Songs, videos, website links, quizzes, flip cards, and a Roku Channel"
New Leaf Publishing Group,https://www.nlpg.com/,https://www.homeschool.com/resource-guide/new-leaf-publishing-group/,Kindergarten; 1st Grade; 2nd Grade; 3rd Grade; 4th Grade; 5th Grade; 6th Grade; 7th Grade; 8th Grade; 9th Grade; 10th Grade; 11th Grade; 12th Grade,One-Time Payment (Materials),"New Leaf Press maintains a strong reputation within the industry for unique, faith-building titles for all ages related to Christian living and incomparable gift books with enduring truths. Working with accomplished"
Don’t Get Fooled,https://www.amazon.com/Dont-Get-Fooled-Fallacies-Deceptions/dp/1479199524,https://www.homeschool.com/resource-guide/dont-get-fooled/,6th Grade; 7th Grade; 8th Grade; 9th Grade; 10th Grade; 11th Grade; 12th Grade,One-Time Payment (Materials),"Learn critical thinking in this introduction to logical fallacies, cognitive biases, and other deceptions exemplified via fun adolescent dialogue."
Introduction to Logic,http://www.masterbooks.com/,https://www.homeschool.com/resource-guide/introduction-to-logic/,8th Grade; 9th Grade; 10th Grade,$41,"Introduction to Logic is a 1-year course designed for grades 8-10, will give a full-year credit for philosophy, & will challenge & inspire students to be able to defend their faith against atheists &"
United Art & Education Homeschooling,https://www.unitednow.com/,https://www.homeschool.com/resource-guide/united-art-education-homeschooling/,Pre-K - 12th Grade,$0.39-$999.99,"United Art & Education provides materials needed for homeschooling including CDs, DVDs, flash cards, games, puzzles, magnets, manipulatives, notebooks, journals, workbooks, resource books, reading tools, science"
Charlotte Mason Simple Languages,https://www.cmsimplelanguages.com/,https://www.homeschool.com/resource-guide/charlotte-mason-simple-languages/,Preschool; Kindergarten; 1st Grade; 2nd Grade; 3rd Grade; 4th Grade,varies by product,The best time to have your children learn an additional language is from the time they are very young. Charlotte Mason believed that exposure from the very beginning through informal lessons is the most effective way to
The Crash Course,https://thecrashcourse.com/courses,https://www.homeschool.com/resource-guide/the-crash-course/,7th Grade; 8th Grade; 9th Grade; 10th Grade; 11th Grade; 12th Grade,FREE,"""Crash Course is one of the best ways to educate yourself, your classmates, and your family on YouTube! From courses like Astronomy to US History and Anatomy & Physiology it's got you covered with an awesome"
DIY Homeschooler Resources,https://diyhomeschooler.com/free-unit-studies/,https://www.homeschool.com/resource-guide/diy-homeschooler-resources/,Kindergarten; 1st Grade; 2nd Grade; 3rd Grade; 4th Grade; 5th Grade; 6th Grade; 7th Grade; 8th Grade; 9th Grade; 10th Grade; 11th Grade; 12th Grade,Free,"At DIY Homeschooler, we provide encouragement and resources to homeschooling parents and guardians paving their own way — solutions to help you “do-it-yourself” when it comes to teaching your children. Among other"
Firm Foundations Academy,http://firm-foundation.org/,https://www.homeschool.com/resource-guide/firm-foundations-academy-2/,1st Grade; 2nd Grade; 3rd Grade; 4th Grade; 5th Grade; 6th Grade; 7th Grade; 8th Grade; 9th Grade; 10th Grade; 11th Grade; 12th Grade,"$2,500",Firm Foundation Academy primarily focuses on improving the literacy and critical thinking skills of students through intensive reading and discussion of literature and philosophy classics. Mixing traditional teaching
Cheerful Cursive,https://www.rainbowresource.com/product/018482/Cheerful-Cursive.html,https://www.homeschool.com/resource-guide/cheerful-cursive/,1st Grade; 2nd Grade; 3rd Grade,$15.95,"Cheerful Cursive is a workbook that teaches children to write in cursive. Taking a traditional approach, this workbook should help your child enjoy learning this forgotten skill. It can be used on its own or as a"
Kitoodle Creators,https://kitoodleshop.com/,https://www.homeschool.com/resource-guide/kitoodle-creators/,Kindergarten; 1st Grade; 2nd Grade; 3rd Grade; 4th Grade; 5th Grade; 6th Grade,varies,"Kitoodle Creators provides a quality STEAM education for students ages 5-12. Through online classes, in-person classes, homeschool semester sets including hands-on projects, and more, your child can learn how and why"
