title,website_url,homeschool_com_url,grades_or_ages,prices_mentioned,description
The Great Courses,https://www.thegreatcoursesplus.com,https://www.homeschool.com/resource-guide/the-great-courses/,9th Grade; 10th Grade; 11th Grade; 12th Grade,$25-$255 per course,"The Great Courses offers many different courses taught by College Professors and are available through streaming or on DVD. They offer Science, Mathematics, Languages, History, Religion, Health & much more."
Saxon Math K Home Study Kit,https://www.hmhco.com/programs/saxon-math,https://www.homeschool.com/resource-guide/saxon-math-k-home-study-kit/,Kindergarten,$96,"Saxon uses an incremental approach to math. Students have a chance to learn and practice a new skill before moving on to the next step, and new concepts build on prior learning. Cumulative practice and assessments"
Thinkwell Homeschool,https://www.thinkwellhomeschool.com/,https://www.homeschool.com/resource-guide/thinkwell-homeschool/,6th Grade; 7th Grade; 8th Grade; 9th Grade; 10th Grade; 11th Grade; 12th Grade,$30-150/course,"Thinkwell is an online math curriculum for middle and high school. Comprehensive and engaging video lessons are accompanied by automatically-graded exercises and quizzes and printable course notes, worksheets, and"
UnLock Math,https://www.unlockmath.com/index.php,https://www.homeschool.com/resource-guide/unlock-math/,Pre-K - 12th Grade,$49/month or $299/year,"UnLock Math is a complete online math curriculum. Each day's lesson includes a warm-up, an engaging video lesson, practice problems, review, and a challenge question. Every few days students complete a short quiz to"
McRuffy Press,https://mcruffy.com,https://www.homeschool.com/resource-guide/mcruffy-press/,Preschool; Kindergarten; 1st Grade; 2nd Grade; 3rd Grade; 4th Grade; 5th Grade,$15-$100,"McRuffy Press offers a lot of options for Preschool - 5th grade. They offer Math, Phonics. Language Arts & Handwriting resources that include teacher helps, detailed lesson plans, math manipulatives, hands-on learning,"
McRuffy Press Kindergarten Letter Logic,https://mcruffy.com/pages/kindergarten-letter-logic,https://www.homeschool.com/resource-guide/mcruffy-press-kindergarten-letter-logic/,Kindergarten,$35-$140,"McRuffy Press Kindergarten Letter Logic is an online Kindergarten phonics & reading course. It includes many games & activities & teacher instructions, printables & online books."
Achieve Beyond,https://www.achievebeyondusa.com/,https://www.homeschool.com/resource-guide/achieve-beyond/,Pre-K - 12th Grade,$1,"Achieve Beyond offers speech, occupational, physical therapies and special education services. They offer pediatric therapies to children, students & families in 7 different states and in many different languages."
Home Science Tools,https://www.homesciencetools.com/homeschool-science,https://www.homeschool.com/resource-guide/home-science-tools/,Pre-K - 12th Grade,$0-$735,Home Science Tools curriculum lab kits include high-quality lab tools and instructions for conducting engaging home science experiments. Each kit comes with most of the needed materials to successfully conduct the
Dad’s Worksheets,https://www.dadsworksheets.com/,https://www.homeschool.com/resource-guide/dads-worksheets/,Pre-K - 12th Grade,FREE,"Dad's Worksheets has a variety of free math printables. Dad'sWorksheets offer homeschool worksheets from basic addition, subtraction, multiplication, division to money, place values, & fractions. These amazing"
Concordia Language Villages,http://www.concordialanguagevillages.org/,https://www.homeschool.com/resource-guide/concordia-language-villages/,Pre-K - 12th Grade,$175-$4830,"Concordia Language Villages is an immersive camp that teaches students & familes different languages through playing games, eating the international foods, making crafts, enjoy music & more. Options for individual"
Spelling-You-See,https://www.spellingyousee.com/,https://www.homeschool.com/resource-guide/spelling-you-see/,,$41-53/set,Spelling You See is a unique spelling program that follows stages of language development and exhibits a linguistic understanding of how students learn to spell while providing meaningful context for learning spelling
Beestar Science,https://beestar.org/,https://www.homeschool.com/resource-guide/beestar-science/,2nd Grade; 3rd Grade; 4th Grade; 5th Grade; 6th Grade; 7th Grade; 8th Grade,Free,Beestar provides weekly Science exercises for Grade 2 ' 8 students. Students apply their knowledge to the problem-solving process. Their analytical thinking and problem-solving skills are improved. Students are
Academics’ Choice,http://www.academicschoice.com/,https://www.homeschool.com/resource-guide/academics-choice/,Pre-K - 12th Grade,N/A,"Discover the world's best mind-building media and toys for homeschooling parents! Academics' Choice Awards' help parents and educators validate claims such as 'critical thinking' and 'educational toy' with a qualified,"
Totally Medieval: The Epic Math Adventure,https://www.thetotallymedievalgame.com/,https://www.homeschool.com/resource-guide/totally-medieval-the-epic-math-adventure/,,$49.99,"TOTALLY MEDIEVAL: THE EPIC MATH ADVENTURE is the first math game of its kind and we know you will love it. It's a mixture of Chess, math, and the Medieval times. We are trying to change a culture that gaming has to be"
Sensory University,https://sensoryuniversity.com/,https://www.homeschool.com/resource-guide/sensory-university/,,Varies per product,"The Sensory University specialized in educational toys for special needs, developmental products for all children and sensory integration resources. Browse through a plethora of educational products that will fit any"
Life of Fred Mathematics,https://www.lifeoffred.uniquemath.com/,https://www.homeschool.com/resource-guide/life-of-fred-mathematics/,Pre-K - 12th Grade,$15.97-$38.97,"Thousands of homeschoolers have turned to Life of Fred Math books for a fun way to learn math. Books include the Elementary Math Series, Intermediate Math Series, Pre-Algebra Series, Financial Choices, High School Math"
ASLdeafined,https://www.asldeafined.com/,https://www.homeschool.com/resource-guide/asldeafined/,,$12-$36/year,ASLdeafined.com is an online American Sign Language video program designed for students wishing to learn American Sign Language. Students are provided with individual logins and progress charts. There are numerous and
Free Educational Resources,https://www.freeeducationalresources.com/,https://www.homeschool.com/resource-guide/free-educational-resources/,Pre-K - 12th Grade,FREE,"Want resources to use at home with your kids that are not just boring worksheets or printables? Then try Free Educational Resources. Weekly spelling books. More math, more writing, and more thinking skills. New"
The Writing Course,https://www.advanced-writing-resources.com/,https://www.homeschool.com/resource-guide/the-writing-course/,,$127,"Here's the link for Dr. Lybrand's tried-and-true system for either freeing reluctant writers from their fears or empowering confident writers to reach the stars. In about 5 minutes a day, any parent can give the exact"
Picaboo Yearbooks,https://www.homeschool.com/resource-guide/picaboo-yearbooks/,https://www.homeschool.com/resource-guide/picaboo-yearbooks/,,$9.49 - $18.99,"Let Picaboo Yearbooks tell your homeschool story. From everyday learning and art projects to adventurous field trips, photos from these special moments deserve to be captured in a personalized yearbook."
MindPlay,https://mindplay.com/,https://www.homeschool.com/resource-guide/mindplay/,Pre-K - 12th Grade,Contact for Quote,MindPlay provides research' and evidence'based screening and differentiated lessons for dyslexic and struggling readers and other readers looking to increase fluency. A Universal Screener diagnoses each student and then
Risas y Sonrisas Spanish for Kids,https://spanishforkids.com/product/homeschool-program/,https://www.homeschool.com/resource-guide/risas-y-sonrisas-spanish-for-kids/,Kindergarten; 1st Grade; 2nd Grade; 3rd Grade; 4th Grade; 5th Grade,$220,"'Laughter & Smiles' is an award-winning, comprehensive, fun and easy to use, multi-grade instructional program for teaching Spanish to elementary school and homeschool children. We provide hands-on tools to play, along"
The Learning Community International School,https://tlcischool.org/,https://www.homeschool.com/resource-guide/the-learning-community-international-school/,Kindergarten; 1st Grade; 2nd Grade; 3rd Grade; 4th Grade; 5th Grade; 6th Grade; 7th Grade; 8th Grade; 9th Grade; 10th Grade; 11th Grade; 12th Grade,$3900-$8900/year,"Directed by homeschool pioneer Manfred Smith, The Learning Community is the perfect marriage of private and home school since 1984. Advisor & Teacher scheduled video conferences & support throughout the year for every"
Mother Goose Time,https://www.mothergoosetime.com/,https://www.homeschool.com/resource-guide/mother-goose-time/,Preschool,$70.99/Month per child,"The Mother Goose Time research-based preschool curriculum creates a platform for children to better know who they are, love others, explore the world and make healthy life choices through sensory-based experiences."
CodeWizardsHQ,https://www.codewizardshq.com/,https://www.homeschool.com/resource-guide/codewizardshq/,3rd Grade; 4th Grade; 5th Grade; 6th Grade; 7th Grade; 8th Grade; 9th Grade; 10th Grade; 11th Grade; 12th Grade,$1,"CodeWizardsHQ is the leading online coding school for kids and teens ages 8-18. CodeWizardsHQ delivers the most fun and effective live, online coding classes which are designed to give students the programming"
Pensacola Christian College,https://www.pcci.edu/Online/DualEnrollment/,https://www.homeschool.com/resource-guide/pensacola-christian-college/,11th Grade; 12th Grade,$340 - $680/class,"Pensacola Christian College is a Christ-centered liberal arts college dedicated to providing excellence in education. With 60 programs of study, PCC offers students academic variety from a biblical perspective in"
NFC Academy,https://www.nflcacademy.com/contact-homeschool.html,https://www.homeschool.com/resource-guide/nfc-academy/,Kindergarten; 1st Grade; 2nd Grade; 3rd Grade; 4th Grade; 5th Grade; 6th Grade; 7th Grade; 8th Grade; 9th Grade; 10th Grade; 11th Grade; 12th Grade,$1341/year,A biblical worldview characterizes the curriculum from Kindergarten all the way through High School at NFC Academy in this fully accredited program. The goal of the program is to provide the highest in educational
Britfield & the Lost Crown,https://www.britfield.com/,https://www.homeschool.com/resource-guide/britfield-the-lost-crown/,6th Grade; 7th Grade; 8th Grade,$9.99 - $19.99,"Based on family, friendship, loyalty, and courage, Britfield & the Lost Crown and its hero, Tom, take readers on an epic adventure across England ' from the smoldering crags of Yorkshire to the heart of London and,"
The Joyful Homeschool Journal,https://www.amazon.com/dp/B07SMB984N/ref=as_li_ss_tl?ie=UTF8&linkCode=sl1&tag=homeschool0b3-20&linkId=02e5ada398ad19afeed26c49dcdde4ca&language=en_US,https://www.homeschool.com/resource-guide/the-joyful-homeschool-journal/,,$2.99,"Sometimes we get busy and forget many of the things for which we are grateful. Joy Journal helps you remember the experiences and events in your life, large and small, that are filled with joy. It gently introduces you"
Homeschool Summer Survival Course,https://www.homeschool.com/article/summertime-homeschooling-survival-guide-planner,https://www.homeschool.com/resource-guide/summertime-survival-guide-for-parents-how-to-create-a-summer-of-wonder-discovery-and-fun/,Pre-K - 12th Grade,Free Download,Discover an exciting way to help your child prevent summer slide! The Homeschool Summer Survival Course That’s where Homeschool.com’s book comes in handy! This book: Teaches you how to develop your child’s
Joyful Homeschooling,https://drive.google.com/file/d/1Jso0aJkCqj76fkT9u0v9Uev93Wam8nJW/view?usp=sharing,https://www.homeschool.com/resource-guide/joyful-homeschooling/,,Free Download,"Your attitude toward your day and toward your children's efforts profoundly affects the outcome of your homeschooling. When you focus on the joys in your life, your days flow better and you accomplish much more. 'Joyful"
Homeschooling and Loving It Workbook!,https://www.amazon.com/dp/1095057669/ref=as_li_ss_tl?ie=UTF8&linkCode=sl1&tag=homeschool0b3-20&linkId=5964cd0f08288b1b70403986a3b7653c&language=en_US,https://www.homeschool.com/resource-guide/homeschooling-and-loving-it-guide-to-creating-your-best-homeschooling-year-ever/,,$9.99,Create your best homeschool ever. Learn the art of stress-free homeschooling so you can homeschool your children without losing your mind or your pocketbook. Use this homeschooling workbook to discover how simple it is
The Keystone School,https://www.keystoneschoolonline.com/adult-learning-programs.html,https://www.homeschool.com/resource-guide/the-keystone-school/,Kindergarten; 1st Grade; 2nd Grade; 3rd Grade; 4th Grade; 5th Grade; 6th Grade; 7th Grade; 8th Grade; 9th Grade; 10th Grade; 11th Grade; 12th Grade,$399-$2890/year,"Keystone provides a student-paced online and print-based curriculum, allowing students to focus on areas that interest them. Credit recovery courses are given as an option to help students pass content they have already"
Light Blue Series,https://www.mathmammoth.com/complete/grade_1.php,https://www.homeschool.com/resource-guide/light-blue-series-grade-1/,1st Grade; 2nd Grade; 3rd Grade; 4th Grade; 5th Grade; 6th Grade; 7th Grade,$15-50,"Math Mammoth uses two workbooks, A and B, each covering half of the year. For grades 1-7. The curriculum is mastery-based and is focused on conceptual understanding, with an emphasis on mental math and number sense."
Columbia Virtual Academy,https://www.cva.org/,https://www.homeschool.com/resource-guide/columbia-virtual-academy/,Pre-K - 12th Grade,Free,"Columbia Virtual Academy is a public, tuition-free K-12 alternative to traditional schools for Washington state residents. A learning plan is created for each student, and there are many options for curriculum so you"
International Virtual Learning Academy,https://internationalvla.com/apex-honors-curriculum/,https://www.homeschool.com/resource-guide/international-virtual-learning-academy/,Pre-K - 12th Grade,"$2,169 - $3,779 per full year","International Virtual Learning Academy is a fully accredited online school for kindergarten through grade 12. We offer affordable online education with certified teachers. Each class is supported by a teacher, each"
Accelerate Online Academy,https://www.accelerate.academy/hsresoguide6_19/index.php,https://www.homeschool.com/resource-guide/accelerate-online-academy/,Pre-K - 12th Grade,$415-$495 per full year course,"At Accelerate Online Academy, students in grades K ' 12 are offered a tuition-based, flexible, yet rigorous academic experience with rich, interactive curriculum, guided by a highly qualified and effective certified"
Abeka Speech for Today,http://www.abeka.com,https://www.homeschool.com/resource-guide/speech-for-today/,9th Grade; 10th Grade; 11th Grade; 12th Grade,$39,"A Beka's Speech for Today is a high school elective student Book. It is a handbook for speech training that teaches speech in a friendly, conversational style. Includes many speaking exercises & selections for"
Abeka French 1 and 2,http://www.abeka.com,https://www.homeschool.com/resource-guide/abeka-french/,9th Grade; 10th Grade; 11th Grade; 12th Grade,$9-$60,"A Beka's French 1 and 2 Series includes a student workbook for high school French, along with vocabulary and test/quiz books. Includes tests that correlate with the French Curriculum, including cumulative 9-week,"
Abeka Spanish 1 and 2,http://www.abeka.com,https://www.homeschool.com/resource-guide/abeka-spanish/,9th Grade; 10th Grade; 11th Grade; 12th Grade,$9-$47,"A Beka's Spanish 1 and 2 is a student course for high school Spanish, grades 10-12. Includes tests, cumulative 9-week, semester & final exams. Students will translate from Spanish to English and English to Spanish."
Blossom and Root,https://blossomandroot.com/third-grade/,https://www.homeschool.com/resource-guide/blossom-and-root/,Preschool; Kindergarten; 1st Grade; 2nd Grade; 3rd Grade,$162,"Blossom and Root is a secular, nature-based, hands-on curriculum for the Pre-K-3rd grades. Blossom and Root has an art program with integrated math concepts, science and nature study, and language arts with integrated"
Which Way USA Book Club,https://www.highlights.com/store/puzzle-book-clubs/which-way-usa,https://www.homeschool.com/resource-guide/which-way-usa-book-club/,1st Grade; 2nd Grade; 3rd Grade; 4th Grade; 5th Grade,$11/month,"Which Way USA takes you on an adventure across the country. Two states are introduced each month with illustrated state maps, puzzle books, and souvenir key tags to collect. Teaches about geography, cultures, and map"
USA Edition,https://www.littlepassports.com/,https://www.homeschool.com/resource-guide/usa-edition/,1st Grade; 2nd Grade; 3rd Grade; 4th Grade; 5th Grade; 6th Grade,$13-16/month,"Little Passports USA Edition is a monthly subscription box designed to let children discover the USA though crafts, games, and puzzles. Two states are introduced each month. The first package is a USA Discovery Kit with"
Science Expeditions,https://www.littlepassports.com/,https://www.homeschool.com/resource-guide/science-expeditions/,3rd Grade; 4th Grade; 5th Grade; 6th Grade,$19-22/month,Little Passports Science Expeditions is a monthly subscription box designed to introduce children to their world through fun and educational STEM activities. The first package is a Science Introductory Kit with a tote
World Edition,https://www.littlepassports.com/,https://www.homeschool.com/resource-guide/world-edition/,1st Grade; 2nd Grade; 3rd Grade; 4th Grade; 5th Grade,$15-18/month,"Little Passports is a monthly subscription box designed to introduce children to world cultures and geography. World Edition teaches 6-10 year olds about their world, one country at a time. The first package is an"
Science Junior,https://www.littlepassports.com/,https://www.homeschool.com/resource-guide/science-junior/,Kindergarten; 1st Grade; 2nd Grade; 3rd Grade,$19-22/month,"Little Passports is a monthly subscription box designed to introduce children to their world. Science Junior teaches 5-8 year olds about themes such as music, rockets, volcanoes, chimpanzees, and wetlands. The first"
Early Explorers,https://www.littlepassports.com/,https://www.homeschool.com/resource-guide/early-explorers/,Preschool,$17-20/month,"Little Passports is a monthly subscription box designed to introduce children to their world. Early Explorers teaches preschoolers about themes like music, the ocean, and dinosaurs. The first package is a Traveler's Kit"
Digging into Diagramming,https://jackrispublishing.com/collections/digging-into-diagramming,https://www.homeschool.com/resource-guide/digging-into-diagramming/,3rd Grade; 4th Grade; 5th Grade; 6th Grade; 7th Grade; 8th Grade,$16-22,Digging into Diagramming is a workbook for diagramming sentences while learning basic grammar concepts. Instructional lessons are followed by diagramming problems to complete. The book progresses from basic sentence
"Starting Line Stories, Levels 6-8",https://jackrispublishing.com/collections/starting-line-stories,https://www.homeschool.com/resource-guide/starting-line-stories-levels-6-8/,6th Grade; 7th Grade; 8th Grade,$16,"This workbook contains 100 creative writing exercises designed to be a break from formal writing assignments. There are 70 story starters, and 30 writing prompts. Space to write stories is provided, with areas to"
"Starting Line Stories, Levels 3-5",https://jackrispublishing.com/collections/starting-line-stories,https://www.homeschool.com/resource-guide/starting-line-stories-levels-3-5/,3rd Grade; 4th Grade; 5th Grade,$16,"This workbook contains 100 creative writing exercises designed to be a break from formal writing assignments. There are 70 story starters, and 30 writing prompts. Space to write stories is provided, with areas to"
Introduction to Language Arts,https://jackrispublishing.com/collections/introduction-to-language-arts,https://www.homeschool.com/resource-guide/introduction-to-language-arts/,Kindergarten,$16-17,"Introduction to Language Arts is a workbook designed to give kindergarteners a head start in language arts. The basics of the first levels of Winning with Writing, Soaring with Spelling and Vocabulary, and Growing with"
Mathematical Reasoning,https://www.criticalthinking.com/mathematical-reasoning.html,https://www.homeschool.com/resource-guide/mathematical-reasoning/,Preschool; Kindergarten; 1st Grade; 2nd Grade; 3rd Grade; 4th Grade; 5th Grade; 6th Grade,$43,"Colorful books and comprehensive, engaging lessons make math concepts fun to learn. Every lesson is followed by a variety of activities to ensure mastery. Lessons spiral slowly. Learners are encouraged to think"
Duolingo Language Learning,https://www.duolingo.com/,https://www.homeschool.com/resource-guide/duolingo/,Pre-K - 12th Grade,Free,"Duolingo is a free and fun way to learn a language online. Short lessons adapt to your learning style, and virtual rewards and instant feedback motivate and build fluency. Over 30 languages are offered. Duolingo is also"
BrainPOP ELL,https://ell.brainpop.com/,https://www.homeschool.com/resource-guide/brainpop-ell/,Pre-K - 12th Grade,$17/month,"BrainPOP ELL is an online English learning program for all ages that includes vocabulary, grammar, reading and writing, and listening. Engaging movies, learning games, puzzles, and other activities encourage learners."
BrainPOP Jr.,https://jr.brainpop.com/,https://www.homeschool.com/resource-guide/brainpop-jr/,Kindergarten; 1st Grade; 2nd Grade; 3rd Grade,$19/month,"BrainPOP Jr. is for younger students, and includes many topics in the areas of science, health, reading and writing, social studies, math, art, and technology. Learners are encouraged to ask questions and form their"
BrainPOP,https://www.brainpop.com/,https://www.homeschool.com/resource-guide/brainpop/,3rd Grade; 4th Grade; 5th Grade; 6th Grade; 7th Grade; 8th Grade,$25/month,"BrainPOP is an online learning site that provides engaging movies, learning games, puzzles, and other activities. Many topics are covered in the areas of technology, math, science, social studies, English, art, music,"
Wyoming Virtual Academy,https://start.k12.com/schoolindividual.html?st=wy&product=wyva&leadsource=drtv&_ga=2.118988174.647208745.1581636185-1073576416.1580427270,https://www.homeschool.com/resource-guide/wyoming-virtual-academy/,Kindergarten; 1st Grade; 2nd Grade; 3rd Grade; 4th Grade; 5th Grade; 6th Grade; 7th Grade; 8th Grade; 9th Grade; 10th Grade; 11th Grade; 12th Grade,Free,"Wyoming Virtual Academy is an online public school for Wyoming residents. WYVA provides an enriching and interactive experience using the K12 curriculum. An individualized learning plan is created for each student, and"
Abeka English Literature,http://www.abeka.com,https://www.homeschool.com/resource-guide/english-literature/,12th Grade,$20-$46,"A Beka's English Literature is a 12th-grade student curriculum. Available in digital or print format. Includes selections from classic authors such as Geoffrey Chaucer, Christopher Marlow, Elizabeth Barrett Browning,"
Abeka American Literature,http://www.abeka.com,https://www.homeschool.com/resource-guide/american-literature/,11th Grade,$20-$46,"A Beka's American Literature is for your 11th grader. Available in digital or print format. Includes selections from classic authors such as Mark Twain, Edgar Allen Poe, Washington Irving & more. Selections are"
Wisconsin Destinations Career Academy,https://start.destinationsacademy.com/dca-schoolindividual.html?st=wi&product=dcawi&leadsource=drtv,https://www.homeschool.com/resource-guide/destinations-career-academy-of-wisconsin/,9th Grade; 10th Grade; 11th Grade; 12th Grade,Free,"Destinations Career Academy of Wisconsin is a tuition-free online public school option for Wisconsin high school students. Students are prepared for success after high school through project-based learning, practical"
Virginia Virtual Academy,https://start.k12.com/schoolindividual.html?st=va&product=vava&leadsource=drtv&vendor=usim&lead_source_detail=lcable&utm_medium=drtv&vanity_url=k12.com-va&utm_source=k12.com-va&utm_campaign=boa&_ga=2.98021784.647208745.1581636185-1073576416.1580427270,https://www.homeschool.com/resource-guide/virginia-virtual-academy/,Kindergarten; 1st Grade; 2nd Grade; 3rd Grade; 4th Grade; 5th Grade; 6th Grade; 7th Grade; 8th Grade; 9th Grade; 10th Grade; 11th Grade; 12th Grade,Free,"Virginia Virtual Academy is an online public school option that provides engaging courses through the K12 curriculum, personalized learning plans, and a vibrant school community. Students and families have opportunities"
Tennessee Virtual High School,https://start.k12.com/schoolindividual.html?st=tn&product=tnva&leadsource=drtv&vendor=usim&lead_source_detail=lcable&utm_medium=drtv&vanity_url=k12.com-tn&utm_source=k12.com-tn&utm_campaign=boa&_ga=2.64483880.647208745.1581636185-1073576416.1580427270,https://www.homeschool.com/resource-guide/tennessee-virtual-high-school/,9th Grade; 10th Grade; 11th Grade; 12th Grade,Free,"Tennessee Virtual High School is an online public school option that provides engaging courses through the K12 curriculum, personalized academic plans, and a vibrant school community. Students are challenged with core"
