title,website_url,source,grades_or_ages,prices_mentioned,description
Swim Lessons In a Box,https://homeschoollanguages.com/products/swim-lessons-in-a-box,Homeschool Languages,Ages 3,$199.00,"Best for ages 3+. Teach your child to swim with confidence, on your schedule, and in a way that fits your family. Swim Lessons in a Box is a ONE-OF-A-KIND, parent-led system designed to help families make real progress in the water. Whether traditional swim lessons haven’t worked for your child, or you simply want a mo"
Level 1 Workbook,https://homeschoollanguages.com/products/bilingual-storybook-series-with-audiobook-copy,Homeschool Languages,,$19.99,"The Level 1 Workbook helps children strengthen the vocabulary and phrases introduced throughout the Homeschool Languages curriculum . While the lessons focus on conversation and real-life language use, the workbook provides a simple way for students to review, practice, and retain what they are learning. These short ac"
Bilingual Portuguese Storybook Set — Homeschool Fairytales (with Audio),https://homeschoollanguages.com/products/bilingual-portuguese-storybooks,Homeschool Languages,,$19.99-$24.99,"The Bilingual Brazilian Portuguese Storybook Series helps homeschool families reinforce everyday language learning through familiar stories children already know and love. Designed to align with the first four units of the Homeschool Languages Brazilian Portuguese Level 1 curriculum, these storybooks gently introduce B"
Level 1 Workbook - Brazilian Portuguese,https://homeschoollanguages.com/products/level-1-workbook-portuguese,Homeschool Languages,,$19.99,"Give your child extra practice and confidence with the Homeschool Languages Portuguese Level 1 Workbook ! ✏️ The Portuguese Level 1 Workbook helps children strengthen the vocabulary and phrases introduced throughout the Homeschool Languages curriculum. While the lessons focus on conversation and real-life language use,"
Bilingual German Storybook Set — Homeschool Fairytales (with Audio),https://homeschoollanguages.com/products/bilingual-german-storybooks,Homeschool Languages,,$19.99-$24.99,"The Bilingual German Storybook Series helps homeschool families reinforce everyday language learning through familiar stories children already know and love. Designed to align with the first four units of the Homeschool Languages German Level 1 curriculum, these storybooks gently introduce German through natural storyt"
Bilingual French Storybook Set — Homeschool Fairytales (with Audio),https://homeschoollanguages.com/products/bilingual-french-storybooks,Homeschool Languages,,$19.99-$24.99,🎧 Audio Included With Every Story Each story includes French audio support so children can listen while following along with the text. Listening to the stories helps children: ✔ Hear French words and phrases in context ✔ Strengthen listening comprehension ✔ Build familiarity with sentence rhythm and flow ✔ Follow the s
American Sign Language Level 1 - International Shipping (SHIPS IN SEPTEMBER),https://homeschoollanguages.com/products/american-sign-language-level-1-international-shipping,Homeschool Languages,Ages 4–10,$249.00,"ASL Level 1 Curriculum Bring American Sign Language into your home with a simple, family-style curriculum made for parents and kids to learn together. ASL Level 1 is an open-and-go curriculum designed for children ages 4–10, with scripted lessons, Deaf-led signing videos, storybooks, games, cards, and hands-on activiti"
French Level 2 - International Shipping,https://homeschoollanguages.com/products/french-level-2-international-shipping,Homeschool Languages,,$249.00,"Homeschool French Curriculum for Kids — Level 2 picks up where Level 1 left off. Now that your kids are speaking French at home, Level 2 helps them talk to and about other people — building real conversations through present-tense conjugation, reflexive pronouns, and everyday routines. A continuation French curriculum "
Brazilian Portuguese Level 1 - International Shipping,https://homeschoollanguages.com/products/brazilian-portuguese-level-1-international-shipping,Homeschool Languages,Ages 4–10,$199.00,Homeschool Brazilian Portuguese Curriculum for Kids — Homeschool Languages helps families teach kids Brazilian Portuguese and learn Portuguese at home with fully scripted Portuguese lessons for kids ages 4–10. Build real bilingual speaking habits through natural Portuguese conversation — even if the parent isn't fluent
test,https://homeschoollanguages.com/products/test,Homeschool Languages,,Free,
Bilingual Spanish Storybook Set — Homeschool Fairytales (with Audio),https://homeschoollanguages.com/products/bilingual-spanish-storybooks,Homeschool Languages,,$19.99-$24.99,"The Bilingual Spanish Storybook Series helps homeschool families reinforce everyday language learning through familiar stories children already know and love. Designed to align with the first four units of the Homeschool Languages Spanish Level 1 curriculum, these storybooks gently introduce Spanish through natural sto"
Homeschool German Curriculum for Kids — Level 2,https://homeschoollanguages.com/products/homeschool-german-curriculum-for-kids-level-2,Homeschool Languages,,$149.00-$325.00,"Homeschool German Curriculum for Kids — Level 2 picks up where Level 1 left off. Now that your kids are speaking German at home, Level 2 helps them talk to and about other people — building real conversations through present-tense conjugation, reflexive pronouns, and everyday routines. A continuation German curriculum "
Homeschool Spanish Curriculum for Kids — Level 2,https://homeschoollanguages.com/products/homeschool-spanish-curriculum-for-kids-level-2,Homeschool Languages,,$111.75-$243.75,"Homeschool Spanish Curriculum for Kids — Level 2 picks up where Level 1 left off. Now that your kids are speaking Spanish at home, Level 2 helps them talk to and about other people — building real conversations through present-tense conjugation, reflexive pronouns, and everyday routines. A continuation Spanish curricul"
Homeschool Portuguese Curriculum for Kids — Level 1,https://homeschoollanguages.com/products/homeschool-portuguese-curriculum-level-1,Homeschool Languages,Ages 4–10,$125.00-$249.00,Homeschool Brazilian Portuguese Curriculum for Kids — Homeschool Languages helps families teach kids Brazilian Portuguese and learn Portuguese at home with fully scripted Portuguese lessons for kids ages 4–10. Build real bilingual speaking habits through natural Portuguese conversation — even if the parent isn't fluent
Homeschool German Curriculum for Kids — Level 1,https://homeschoollanguages.com/products/homeschool-german-curriculum-level-1,Homeschool Languages,Ages 4–10,$125.00-$249.00,Homeschool German Curriculum for Kids — Homeschool Languages helps families teach kids German and learn German at home with fully scripted German lessons for kids ages 4–10. Build real bilingual speaking habits through natural German conversation — even if the parent isn't fluent.
Homeschool French Curriculum for Kids — Level 1,https://homeschoollanguages.com/products/homeschool-french-curriculum-level-1,Homeschool Languages,Ages 4–10,$125.00-$249.00,Homeschool French Curriculum for Kids — Homeschool Languages helps families teach kids French and learn French at home with fully scripted French lessons for kids ages 4–10. Build real bilingual speaking habits through natural French conversation — even if the parent isn't fluent.
Homeschool Spanish Curriculum for Kids — Level 1,https://homeschoollanguages.com/products/homeschool-spanish-curriculum-level-1,Homeschool Languages,Ages 4–10,$125.00-$249.00,Homeschool Spanish Curriculum for Kids — Homeschool Languages helps families build real Spanish-speaking habits at home with fully scripted lessons for kids ages 4–10 that guide parents and children through natural conversation in Spanish — even if the parent isn't fluent.
Level 2: The Step-by-Step Language Curriculum Designed for Homeschool Families,https://homeschoollanguages.com/products/level-2-the-step-by-step-language-curriculum-designed-for-homeschool-families,Homeschool Languages,,$149.00-$377.00,"Take the next step in your homeschool language journey with Homeschool Languages Level 2 ! 🌟 Level 2 builds on the foundation created in Level 1 and helps children grow into more confident, natural speakers through longer sentences, expanded vocabulary, and more dynamic conversation practice. While Level 1 introduces c"
Level 1 Workbook - German,https://homeschoollanguages.com/products/level-1-workbook-german,Homeschool Languages,,$19.99,"Give your child extra practice and confidence with the Homeschool Languages German Level 1 Workbook ! ✏️ The German Level 1 Workbook helps children strengthen the vocabulary and phrases introduced throughout the Homeschool Languages curriculum. While the lessons focus on conversation and real-life language use, the wor"
Level 1 Workbook - French,https://homeschoollanguages.com/products/level-1-workbook-french,Homeschool Languages,,$19.99,"Give your child extra practice and confidence with the Homeschool Languages French Level 1 Workbook ! ✏️ The French Level 1 Workbook helps children strengthen the vocabulary and phrases introduced throughout the Homeschool Languages curriculum. While the lessons focus on conversation and real-life language use, the wor"
Level 1 Workbook - Spanish,https://homeschoollanguages.com/products/level-1-workbook-spanish,Homeschool Languages,,$19.99,"Give your child extra practice and confidence with the Homeschool Languages Spanish Level 1 Workbook ! ✏️ The Spanish Level 1 Workbook helps children strengthen the vocabulary and phrases introduced throughout the Homeschool Languages curriculum. While the lessons focus on conversation and real-life language use, the w"
"""Let's Say a Family Prayer!"" Unit",https://homeschoollanguages.com/products/lets-say-a-family-prayer-unit,Homeschool Languages,,$47.00-$99.00,"Start Your Family Prayer Routine in a New Language Turn your family prayer time into a meaningful bilingual routine your children will love! The Family Prayer Unit helps children learn how to gather for prayer, express gratitude, ask for help, and develop reverence—all while practicing a new language together as a fami"
Your Guatemalan Journey,https://homeschoollanguages.com/products/your-guatemalan-journey,Homeschool Languages,,$720.00-$1080.00,"Bring language learning to life with an unforgettable family Spanish immersion experience in beautiful Guatemala. Your Guatemalan Journey is designed for homeschool families who want their children to see, hear, and experience Spanish in a real-world setting. Instead of only practicing language at home, families will s"
Bilingual Storybook Series (with Audiobook),https://homeschoollanguages.com/products/bilingual-storybook-series,Homeschool Languages,,$19.99-$24.99,"The Bilingual Storybook Series helps homeschool families reinforce everyday language learning through familiar stories children already know and love. Designed to align with the first four units of the Homeschool Languages Level 1 curriculum , these storybooks gently introduce Spanish, French, German, Brazilian Portugu"
Homeschool French Curriculum for Kids — Level 2,https://homeschoollanguages.com/products/homeschool-french-curriculum-for-kids-level-2,Homeschool Languages,,$149.00-$325.00,"Homeschool French Curriculum for Kids — Level 2 picks up where Level 1 left off. Now that your kids are speaking French at home, Level 2 helps them talk to and about other people — building real conversations through present-tense conjugation, reflexive pronouns, and everyday routines. A continuation French curriculum "
ASL Level 1 (Pre-Order),https://homeschoollanguages.com/products/asl-level-1-pre-order,Homeschool Languages,,$225.00-$374.00,
LEVEL 1: The Step-by-Step Language Curriculum Designed for Homeschool Families,https://homeschoollanguages.com/products/level-1,Homeschool Languages,Ages 4–10,$125.00-$354.00,Homeschool Languages helps families build real speaking habits at home with fully scripted lessons for kids ages 4–10 that guide parents and children through natural conversation — even if the parent is not fluent.
