title,website_url,source,grades_or_ages,prices_mentioned,description
HSLDA Membership,https://hslda.org/membership,HSLDA,Grades K-12,$15-$1500,"Get affordable legal support for homeschooling today. Learn more about the benefits, price, and eligibility. Discount for military & first responders"
HSLDA Membership,https://hslda.org/jointoday,HSLDA,Grades K-12,$15-$1500,"Get affordable legal support for homeschooling today. Learn more about the benefits, price, and eligibility. Discount for military & first responders"
Homeschool Laws By State,https://hslda.org/laws,HSLDA,Grades K-12,Free,"Choose your state or territory to get detailed information on how to withdraw from public school, homeschooling requirements including testing & mandatory subjects, plus resources and more."
Homeschool Laws By State,https://hslda.org/legal,HSLDA,Grades K-12,Contact for pricing,"Choose your state or territory to get detailed information on how to withdraw from public school, homeschooling requirements including testing & mandatory subjects, plus resources and more."
Homeschooling With Special Needs,https://hslda.org/teaching-my-kids/special-needs,HSLDA,Grades K-12,Contact for pricing,Homeschooling offers you the freedom and flexibility to individualize your child's education by molding curriculum and schedules to meet their needs.
HSLDA Lifetime Membership,https://hslda.org/membership,HSLDA,Grades K-12,$1500.00,Homeschool Legal Defense Association membership plan.
HSLDA Pay Yearly Membership,https://hslda.org/membership,HSLDA,Grades K-12,$150.00,Homeschool Legal Defense Association membership plan.
HSLDA Pay Monthly Membership,https://hslda.org/membership,HSLDA,Grades K-12,$15.00/month,Homeschool Legal Defense Association membership plan.
