title,website_url,source,grades_or_ages,prices_mentioned,description
Exploring Creation with Physical Science,https://timberdoodle.com/products/exploring-creation-with-physical-science,Timberdoodle,,$0.00-$172.00,"Exploring Creation with Physical Science discusses such topics as the atmosphere, the hydrosphere, weather, the structure of the earth, environmentalism..."
Exploring Creation with Physics,https://timberdoodle.com/products/exploring-creation-with-physics,Timberdoodle,,$0.00-$121.00,"Exploring Creation with Physics is a college-prep physics course that provides a detailed introduction to the methods and concepts of general physics, h..."
Exploring Creation with Zoology 1,https://timberdoodle.com/products/zoology-1,Timberdoodle,,$0.00-$94.00,"Exploring Creation with Zoology 1, Flying Creatures of the 5th Day. This one-year science curriculum is an exciting study of animal classification and c..."
Exploring Creation with Zoology 2,https://timberdoodle.com/products/zoology-2,Timberdoodle,,$0.00-$94.00,"Exploring Creation with Zoology 2, Swimming Creatures of the 5th Day. This one-year science curriculum is an exciting study of animal classification and..."
Exploring Creation with Zoology 3,https://timberdoodle.com/products/zoology-3,Timberdoodle,,$0.00-$94.00,"Exploring Creation with Zoology 3, Land Animals of the 6th Day. This one-year science curriculum is an exciting study of animal classification and chara..."
Exploring Economics Curriculum Package,https://timberdoodle.com/products/exploring-economics-curriculum-package,Timberdoodle,,$0.00-$70.00,"Exploring Economics is a Bible-based, one-semester course designed for high schoolers to understand the economy with clarity. Covering real-world money ..."
Exploring Economics Quiz and Exam Pack,https://timberdoodle.com/products/exploring-economics-quiz-and-exam-pack,Timberdoodle,K,$0.00-$15.00,"The Exploring Economics Quiz \u0026 Exam Pack provides daily review questions, quizzes, and exams aligned with the course. With a full answer key, it helps k..."
Exploring Government,https://timberdoodle.com/products/exploring-government,Timberdoodle,,$0.00-$70.00,"Exploring Government, 4th Edition is a Bible-based, one-semester course that offers teens a clear, practical look at U.S. government. With 75 daily less..."
Exploring Government Student Review Pack,https://timberdoodle.com/products/exploring-government-student-review-pack,Timberdoodle,,$0.00-$15.00,"Provides literary analysis for the optional English component, review questions for each lesson, weekly quizzes, three exams, and an answer key."
Exploring World History,https://timberdoodle.com/products/exploring-world-history-curriculum-package,Timberdoodle,,$0.00-$125.00,"Exploring World History offers a comprehensive, Bible-based curriculum that provides 3 high school credits: 1 in literature, 1 in history, and 1 in Bibl..."
Exploring World History Student Review Pack,https://timberdoodle.com/products/exploring-world-history-student-review-pack,Timberdoodle,,$0.00-$20.00,"The optional Exploring World History Student Review Pack includes lesson review questions, literature review questions, literary analysis, Bible comment..."
Extreme Dot to Dot: US History,https://timberdoodle.com/products/extreme-dot-to-dot-us-history,Timberdoodle,,$0.00-$9.95,"Extreme Dot to Dot: U.S. History puzzles range from 500 to over 1,400 dots. Some puzzles even cover a two-page spread! Counting, mapping and concentrati..."
Faber-Castell Grip Colored EcoPencils - 24 pc,https://timberdoodle.com/products/faber-castell-grip-colored-ecopencils-24-pc,Timberdoodle,,$0.00-$15.00,"Faber-Castell's Grip Colored EcoPencils feature an ergonomic triangular barrel and patented grip zone for fatigue-free, comfortable drawing. Not only th..."
Faber-Castell Pencil Sharpener,https://timberdoodle.com/products/faber-castell-pencil-sharpener,Timberdoodle,,$0.00-$4.95,A must-have for homeschoolers! This kid-friendly Faber-Castell Sharpener handles jumbo and standard pencils and keeps shavings mess-free with built-in s...
Faces Puzzles,https://timberdoodle.com/products/on-the-go-puzzle-halves-faces,Timberdoodle,,$5.00,On the Go Puzzle Halves Faces
Famous Artists Creative Box,https://timberdoodle.com/products/famous-artists-creative-box,Timberdoodle,,$0.00-$39.99,Explore iconic artists like Van Gogh and Kahlo with hands-on art projects! The Famous Artists Creative Box blends fine-motor skill building with STEAM l...
Famous Figures of Ancient Times,https://timberdoodle.com/products/famous-figures-of-ancient-times,Timberdoodle,,$0.00-$21.95,"Your child colors detailed figures from Egypt, Greece, and Rome while you read aloud. Famous Figures of Ancient Times makes history stick."
Famous Figures of the American Revolution,https://timberdoodle.com/products/famous-figures-of-the-american-revolution,Timberdoodle,,$0.00-$18.95,"Your kids color, cut out, and display figures from the American Revolution. Famous Figures makes history hands-on for kids who learn through art."
Famous Figures of the Civil War,https://timberdoodle.com/products/famous-figures-of-the-civil-war,Timberdoodle,,$0.00-$18.95,"Your child colors, cuts out, and displays Civil War figures with Famous Figures of the Civil War. Ideal for kids who learn best through art."
Famous Figures of the Early Modern Era,https://timberdoodle.com/products/famous-figures-of-the-early-modern-era,Timberdoodle,,$0.00-$21.95,Your child colors figures from the Reformation through the Enlightenment while you read aloud. Famous Figures of the Early Modern Era makes history real.
Famous Figures of the Middle Ages \u0026 Renaissance,https://timberdoodle.com/products/famous-figures-of-the-middle-ages-renaissance,Timberdoodle,,$0.00-$21.95,"If you have a child who dreads reading but loves art and drama, the Famous Figures series is the perfect history supplement for her."
Farmland Math: Town and Farm Edition,https://timberdoodle.com/products/farmland-math-town-and-farm-edition,Timberdoodle,Preschool,$0.00-$79.95,"Make preschool math a hands-on adventure with Farmland Math: Town \u0026 Farm Edition! Packed with colorful manipulatives, fun stories, and engaging lessons,..."
Felter Finger Guards,https://timberdoodle.com/products/felter-finger-guards,Timberdoodle,,$6.00,"Protect your fingers while needle felting and other tasks with these high-quality German leather finger guards. Thick yet supple, they offer excellent p..."
Fire Brigade Stacking Toy,https://timberdoodle.com/products/fire-brigade-stacking-toy,Timberdoodle,,$0.00-$24.99,"A cheerful fire-brigade stacking challenge where kids match templates, balance wooden blocks, solve spatial puzzles, and narrate rescue missions—strengt..."
First Language Lessons 3,https://timberdoodle.com/products/first-language-lessons-3-bundle,Timberdoodle,,$0.00-$56.95,"With two to three short lessons a week, First Language Lessons Level 3 covers a full range of grammar topics, including parts of speech, punctuation, se..."
First Language Lessons 4,https://timberdoodle.com/products/first-language-lessons-4-bundle,Timberdoodle,,$0.00-$56.95,"With two to three short lessons a week, First Language Lessons Level 4 covers a full range of grammar topics, including parts of speech, punctuation, se..."
First Language Lessons Level 1,https://timberdoodle.com/products/first-language-lessons-1,Timberdoodle,,$0.00-$18.95,"With two to three short lessons a week, First Language Lessons Level 1 covers a full range of grammar topics, including parts of speech, punctuation, se..."
First Language Lessons Level 2,https://timberdoodle.com/products/first-language-lessons-2,Timberdoodle,,$0.00-$19.95,"With two to three short lessons a week, First Language Lessons Level 2 covers a full range of grammar topics, including parts of speech, punctuation, se..."
First Sticker Book - Your Body,https://timberdoodle.com/products/first-sticker-book-your-body,Timberdoodle,,$0.00-$7.99,"Perfect for homeschool preschoolers, First Sticker Book—Your Body uses over 150 stickers to teach anatomy, senses, and health through hands-on scenes th..."
First Words Around the Home,https://timberdoodle.com/products/first-words-around-the-home,Timberdoodle,,$0.00-$10.99,First Words Around the Home introduces toddlers to over 100 objects found in their everyday surroundings. This engaging book encourages early learning c...
Fischertechnik Advanced Universal 4 with Engineer,https://timberdoodle.com/products/fischertechnik-advanced-universal-4,Timberdoodle,,$0.00-$149.99,Fuel your child’s engineering curiosity with Fischertechnik Advanced Universal 4! This durable STEM building kit lets kids create up to 40 mechanical mo...
Fischertechnik E-Tronic,https://timberdoodle.com/products/e-tronic,Timberdoodle,,$0.00-$229.99,Let your teen dive into real-world electronics with Fischertechnik E-Tronic! This hands-on STEM course covers everything from basic circuits to complex ...
Fischertechnik Green Energy Kit,https://timberdoodle.com/products/fischertechnik-green-energy,Timberdoodle,,$0.00-$169.99,Empower your teen to explore renewable energy with Fischertechnik Green Energy Kit! This hands-on kit lets students build and test 14 real-world models ...
Fischertechnik Junior Max,https://timberdoodle.com/products/fischertechnik-junior-max,Timberdoodle,,$0.00-$84.99,"Slide pieces together and watch simple machines come to life. Fischertechnik Junior Max introduces early engineering through real, working models."
Fischertechnik Junior Pro,https://timberdoodle.com/products/fischertechnik-junior-pro,Timberdoodle,,$0.00-$45.99,"Wheels spin, gears turn, and young builders discover how simple machines work—hands-on. Fischertechnik Junior Pro makes engineering click."
Fischertechnik Profi Mechanic \u0026 Static 2 with Engineer,https://timberdoodle.com/products/fischertechnik-profi-mechanic-static-2,Timberdoodle,,$0.00-$189.99,"Unlock real-world engineering with Fischertechnik Profi Mechanic \u0026 Static 2! With 500 precision-engineered pieces, this kit lets students build 30 model..."
Flags of the World - Poppik,https://timberdoodle.com/products/flags-of-the-world,Timberdoodle,,$0.00-$24.99,"Make geography hands-on with Flags of the World! Perfect for homeschool, this interactive map lets kids track global reading adventures with nearly 200 ..."
Floats McGoats,https://timberdoodle.com/products/floats-mcgoats,Timberdoodle,,$0.00-$24.99,"Wacky goats, raft drama, and a dice-rolling shark—Floats McGoats is family game night gold! Build, rescue, and outwit in this laugh-out-loud strategy ga..."
Flower Whistle,https://timberdoodle.com/products/flower-whistle,Timberdoodle,,$0.00-$15.95,"This soft, chewable whistle builds early speech and feeding muscles through fun, multisensory play. A joyful way to support your baby's development duri..."
Fluenz Homeschool Subscription,https://timberdoodle.com/products/fluenz-homeschool,Timberdoodle,,$0.00-$399.00,"Designed to prepare your children for the most common situations they could face in another country, with Fluenz they will develop a strong foundation i..."
Friendly Biology - Christian Worldview,https://timberdoodle.com/products/friendly-biology,Timberdoodle,,$0.00-$99.95,"Transform your teen’s view of biology with Friendly Biology! This course blends clear explanations, engaging hands-on labs (many using common kitchen it..."
Friendly Biology - Nonreligious Worldview,https://timberdoodle.com/products/friendly-biology-nonreligious-worldview,Timberdoodle,,$0.00-$99.95,"Turn science into a fun, relatable subject with Friendly Biology! Designed for teens, this secular biology course covers everything from genetics to hum..."
Friendly Biology - Video License,https://timberdoodle.com/products/friendly-biology-video-license,Timberdoodle,,$0.00-$99.99,The Friendly Biology video course provides your video instruction for Christian-Worldview and Nonreligious Friendly Biology from series author Dr. Joey ...
Friendly Chemistry - Video License,https://timberdoodle.com/products/friendly-chemistry-video-license,Timberdoodle,,$0.00-$99.99,Friendly Chemistry covers all of the topics typically taught in a traditional high school chemistry course.
"Friendly Chemistry, 4th Edition",https://timberdoodle.com/products/friendly-chemistry,Timberdoodle,,$0.00-$79.95,"Turn chemistry into a manageable, even enjoyable, subject with Friendly Chemistry! This independent learning course covers everything from atomic theory..."
Friendly Driver's Education,https://timberdoodle.com/products/friendly-drivers-education,Timberdoodle,,$0.00-$59.99,"Help your teen become a confident, informed driver with Friendly Driver's Education. This engaging course covers everything from car mechanics to real-w..."
Friendly Driver's Education - Video License,https://timberdoodle.com/products/friendly-drivers-education-video-course,Timberdoodle,,$0.00-$49.99,"Friendly Driver's Education Video License helps your teen become a confident, informed driver, covering everything from car mechanics to real-world driv..."
Friendly Physical Science,https://timberdoodle.com/products/friendly-physical-science,Timberdoodle,,$0.00-$99.95,"Make physical science fun and accessible with Friendly Physical Science Set! Designed for teens, this course covers everything from Newton's laws to ele..."
Friendly Physical Science - Video License,https://timberdoodle.com/products/friendly-physical-science-video-license,Timberdoodle,,$0.00-$99.99,Friendly Physical Science provides your young teen with an approachable means to explore and make sense of how and why things do what they do. Using str...
From Adam to Us,https://timberdoodle.com/products/from-adam-to-us,Timberdoodle,,$0.00-$125.00,From Adam to Us is a one-year world history and literature course designed for students in grades five through eight. The daily lessons are written in a...
From Adam to Us Curriculum,https://timberdoodle.com/products/from-adam-to-us-curriculum-package,Timberdoodle,,$125.00,From Adam to Us is a one-year world history and literature course designed for students in grades five through eight. The daily lessons are written in a...
From Adam to Us Lesson Review,https://timberdoodle.com/products/from-adam-to-us-lesson-review,Timberdoodle,,$0.00-$12.00,"From Adam to Us Lesson Review features daily lesson review questions, literature review questions, and unit tests."
From Adam to Us Map Book,https://timberdoodle.com/products/from-adam-to-us-map-book,Timberdoodle,,$0.00-$10.00,"From Adam to Us Map Book's collection of 43 maps was created primarily to accompany the curriculum. At the end of many lessons, your student will do act..."
From Adam to Us Student Workbook,https://timberdoodle.com/products/from-adam-to-us-student-workbook,Timberdoodle,,$0.00-$14.00,"From Adam to Us Student Workbook is a collection of crosswords, word searches, matching, and other handwork activities reviews and reinforces informatio..."
From Adam to Us Timeline Book,https://timberdoodle.com/products/from-adam-to-us-timeline-book,Timberdoodle,,$0.00-$10.00,From Adam to Us Timeline Book is a timeline of history from Creation to the present. It is designed specifically to accompany the From Adam to Us curric...
Gakken Big Preschool Workbook,https://timberdoodle.com/products/gakken-big-preschool-workbook,Timberdoodle,Preschool,$0.00-$14.99,"Short, colorful activities that fit into the moments your four-year-old is ready to sit. Covers letters, numbers, cutting, and early reasoning."
Gakken Sticker Learning Collection,https://timberdoodle.com/products/gakken-sticker-learning-collection,Timberdoodle,Preschool,$0.00-$29.99,"Make learning joyful with the Sticker Learning Collection! Packed with 200–500+ stickers per book, this homeschool favorite builds preschool skills like..."
Garden Bugs Paint Set,https://timberdoodle.com/products/garden-bugs-paint-set,Timberdoodle,,$0.00-$11.99,"Paint is printed right on the page—just add water. Four garden bug scenes help your child practice brush skills with beautiful, mess-free results."
Garden Collage Sensory Craft Box,https://timberdoodle.com/products/garden-collage-sensory-craft-box,Timberdoodle,,$0.00-$39.99,"Packed with 1,000+ crafty pieces, the Garden Collage Sensory Craft Box lets preschoolers explore art, sensory play, and fine-motor skills through flower..."
General Science 101,https://timberdoodle.com/products/general-science-101,Timberdoodle,,$0.00-$84.95,"Make homeschool science unforgettable with General Science 101, a faith-based high school course packed with vivid visuals, hands-on labs, and a biblica..."
Genius Connection,https://timberdoodle.com/products/genius-connection,Timberdoodle,,$0.00-$27.99,"Race to connect your path in Genius Connection—a fast-paced, logic-packed puzzle game where no two rounds are ever the same! Builds critical thinking, s..."
Geomag Preschool STEM,https://timberdoodle.com/products/geomag-preschool-stem,Timberdoodle,Preschool,$0.00-$39.99,"Magnetic cubes snap together on every side, turning challenge cards into 3D builds that strengthen spatial thinking and early engineering skills."
GeoPuzzles set of 7,https://timberdoodle.com/products/geopuzzles-set-of-7,Timberdoodle,,$0.00-$99.99,"Seven regional puzzles let your child build the world piece by piece—connecting borders, continents, and countries through hands-on geography."
GeoStix Letter Construction Set,https://timberdoodle.com/products/geostix-letter-construction-set,Timberdoodle,,$0.00-$38.99,"GeoStix turns letter building into bendy, sensory-rich fun! Kids snap, sort, and shape their way to stronger motor skills, letter recognition, and creat..."
Gobblet Gobblers,https://timberdoodle.com/products/gobblet-gobblers,Timberdoodle,,$0.00-$24.99,"Gobblet Gobblers incorporates the ease of tic-tac-toe with a twist that virtually eliminates stalemates. In it, you can move any of your pieces that are..."
Golden Wheat Bakery,https://timberdoodle.com/products/golden-wheat-bakery,Timberdoodle,,$0.00-$44.99,"Golden Wheat Bakery is a cozy DIY miniature kit with snap-together pieces, charming details, and a glowing oven—perfect for aspiring bakers who love tin..."
Got Five!,https://timberdoodle.com/products/got-five,Timberdoodle,,$0.00-$24.99,"Five hidden numbers everyone else can see but you can't. Ask smart questions, eliminate options, and figure out your hand before anyone else does."
Grade 1 - Singapore Primary Mathematics,https://timberdoodle.com/products/primary-mathematics-1-bundle,Timberdoodle,Grade 1; 1St Grade,$0.00-$149.99,"Primary Mathematics 1st Grade deepens math understanding the Singapore way. Your child learns why math works, not just how to get the answer."
Grade 2 - Singapore Primary Mathematics,https://timberdoodle.com/products/primary-mathematics-2-bundle,Timberdoodle,Grade 2,$0.00-$149.99,Second graders build deep conceptual math skills with Primary Mathematics 2. Singapore Math that goes well beyond drills and memorization.
Grade 3 - Singapore Primary Mathematics,https://timberdoodle.com/products/primary-mathematics-3-bundle,Timberdoodle,Grade 3,$0.00-$159.99,"Your 3rd grader goes further with Singapore Math in Primary Mathematics 3. Problem-solving that builds genuine understanding, not just procedures."
Grade 4 - Singapore Primary Mathematics,https://timberdoodle.com/products/primary-mathematics-4-bundle,Timberdoodle,Grade 4,$0.00-$130.75,Your 4th grader develops strong reasoning and problem-solving skills with Primary Mathematics 4. Singapore Math that goes deeper than drills.
Grade 5 - Singapore Primary Mathematics,https://timberdoodle.com/products/primary-mathematics-5-bundle,Timberdoodle,Grade 5,$0.00-$130.75,"Typical math programs, called procedural math programs, tend to focus on memorizing math facts and procedures and practicing drills. Singapore Primary M..."
Grammar for the Well-Trained Mind - Blue Bundle,https://timberdoodle.com/products/grammar-for-the-well-trained-mind-blue-bundle,Timberdoodle,,$0.00-$101.75,"Make grammar click with the Blue Bundle! Scripted lessons, clear rules, and varied exercises help your homeschooler master writing and communication—wit..."
Grammar for the Well-Trained Mind - Purple Bundle,https://timberdoodle.com/products/grammar-for-the-well-trained-mind-purple-bundle,Timberdoodle,,$0.00-$101.75,"Turn grammar groans into “got it!” moments with the Purple Bundle. Scripted lessons, smart explanations, and fresh exercises make mastery engaging and h..."
Grammar for the Well-Trained Mind - Red Bundle,https://timberdoodle.com/products/grammar-for-the-well-trained-mind-red,Timberdoodle,,$0.00-$101.75,"Tame tricky grammar with this clear, confidence-building bundle! Scripted lessons, detailed answers, and fresh exercises make mastery doable and even fu..."
Grammar for the Well-Trained Mind - Yellow,https://timberdoodle.com/products/grammar-for-the-well-trained-mind-yellow,Timberdoodle,,$0.00-$101.75,"Master grammar without the groans! The Yellow Bundle blends clear rules, fun repetition, and flexible lessons to help your homeschooler write and speak ..."
Graphic Design 101,https://timberdoodle.com/products/graphic-design-101,Timberdoodle,,$0.00-$300.00,Graphic Design 101 teaches teens real-world design skills through video lessons and hands-on projects. This self-paced homeschool elective builds creati...
Graphic Shakespeare,https://timberdoodle.com/products/graphic-shakespeare,Timberdoodle,,$0.00-$16.99,"Graphic Shakespeare makes the Bard’s classics bold, visual, and teen-friendly. With original lines, modern captions, and stunning art, it’s Shakespeare ..."
Graphic U.S. History - Set of 13,https://timberdoodle.com/products/graphic-u-s-history,Timberdoodle,,$0.00-$149.95,These Graphic U.S. History books are stuffed with intriguing historical facts about American History. The best history course for reluctant readers and ...
GraviTrax Academy Bundle,https://timberdoodle.com/products/gravitrax-academy-bundle,Timberdoodle,,$0.00-$112.95,"GraviTrax Academy turns physics into fun with 140+ marble-run pieces, transfer elements, and brainy build challenges. Boost STEM skills with every twist..."
Great Buildings,https://timberdoodle.com/products/great-buildings,Timberdoodle,Pre-K,$0.00-$19.95,"Take a world tour of iconic buildings with Great Buildings. From the Parthenon to the Statue of Liberty, this interactive picture book introduces pre-k ..."
Grizzly Gears,https://timberdoodle.com/products/grizzly-gears,Timberdoodle,,$0.00-$27.99,"Navigate rotating trees and forest critters in Grizzly Gears, a twisty puzzle adventure with 80 logic challenges. Builds strategic thinking, focus, and ..."
Gygès,https://timberdoodle.com/products/gyges,Timberdoodle,,$0.00-$59.99,No pieces belong to either player—every move uses whatever is closest. A deceptively simple strategy game that rewards creative thinking.
Gymnic Physio Roll - Red,https://timberdoodle.com/products/gymnic-physio-roll-red,Timberdoodle,,$0.00-$64.99,"The Gymnic Physio Roll supports your baby’s development with safe, one-directional movement for balance, core strength, and coordination. Perfect for ho..."
HABA Kullerbu Momentum Motor Ambulance,https://timberdoodle.com/products/haba-kullerbu-momentum-motor-ambulance,Timberdoodle,,$0.00-$9.99,"Give it a push and this sturdy little ambulance races ahead, sparking early physics exploration, whole-body movement, and lively rescue storytelling. To..."
HABA Kullerbu Red Speedster,https://timberdoodle.com/products/haba-kullerbu-red-speedster,Timberdoodle,,$0.00-$9.99,"A quick push sends the Kullerbu Red Speedster zooming, teaching cause-and-effect, coordination, and early STEM through nonstop motion. Tough, toddler-fr..."
HABA Popping Frog Silicone Teething Toy,https://timberdoodle.com/products/haba-popping-frog-silicone-teething-toy,Timberdoodle,,$0.00-$9.99,"A soft, soothing silicone frog that babies chew, pop, and fidget with for gum relief, fine-motor practice, sensory focus, and easy self-soothing. Lightw..."
HABA Star Silicone Clutching Teether,https://timberdoodle.com/products/haba-star-silicone-clutching-teether,Timberdoodle,,$0.00-$9.99,"Easy to grasp, chew, and rotate, this textured silicone star soothes sore gums and supports sensory exploration, fine-motor skills, and early oral-motor..."
HABA Terra Kids 4-Way Flashlight,https://timberdoodle.com/products/haba-terra-kids-4-way-flashlight,Timberdoodle,,$0.00-$14.99,"A real kid-sized tool for real adventures, this rugged 4-Way Flashlight lets children control brightness, explore confidently, learn safety skills, and ..."
Habitat Puzzle,https://timberdoodle.com/products/habitat-puzzle,Timberdoodle,,$0.00-$9.99,"Help your toddler build logic, language, and fine-motor skills with Habitat Puzzles! Match animals to their homes in this fun, hands-on homeschool activ..."
Hand-Poured Cement Workshop,https://timberdoodle.com/products/hand-poured-cement-workshop,Timberdoodle,,$0.00-$85.00,"Mix, pour, and cure real cement into finished pieces your teen designs. A hands-on workshop that produces something solid and lasting."
Handwriting Pre-K / Kindergarten Teacher Guidebook,https://timberdoodle.com/products/handwriting-pre-k-kindergarten-teacher-guidebook,Timberdoodle,Pre-K; Kindergarten,$0.00-$32.95,"Take the guesswork out of early handwriting! This guide includes lesson plans, tips, and resources to make Pre-K and Kindergarten handwriting purposeful..."
Happy Cheetah Cub Starting Workbook: Level 1,https://timberdoodle.com/products/happy-cheetah-cub-starting-workbook-level-1,Timberdoodle,,$10.00,"Using current research in reading and how the brain learns, Happy Cheetah lays a foundation and builds slowly, using repetition to build fluency. Childr..."
