title,website_url,source,grades_or_ages,prices_mentioned,description
Plus-Plus Isoscapes - Maritime Sailboat,https://timberdoodle.com/products/plus-plus-isoscapes-sailboat,Timberdoodle,,$0.00-$39.99,Chart a course for creativity with Plus-Plus Isoscapes! This unique shipbuilding kit enhances homeschooling with hands-on learning focused on spatial re...
Plus-Plus Isoscapes: Cabin,https://timberdoodle.com/products/plus-plus-isoscapes-cabin,Timberdoodle,,$0.00-$39.99,"Discover the joy of hands-on learning with Plus-Plus Isoscapes, the perfect homeschooling project for teens. This cabin-building kit fosters spatial rea..."
Plus-Plus Isoscapes: Metropolis,https://timberdoodle.com/products/plus-plus-isoscapes-metropolis,Timberdoodle,,$0.00-$39.99,"Transform your teen’s creative potential with Plus-Plus Isoscapes! This city-building kit combines fun and education, offering hands-on learning in arch..."
Postman Observation Game,https://timberdoodle.com/products/postman-observation-game,Timberdoodle,Ages 3,$0.00-$44.00,"Build a city, race to deliver the mail, and outsmart your opponents! Postman Observation Game boosts memory, visual skills, and fast thinking for ages 3+."
Practical Critical Thinking,https://timberdoodle.com/products/practical-critical-thinking-grades-9-12-bundle,Timberdoodle,,$0.00-$67.98,Prepare your teen for the world of misinformation with Practical Critical Thinking! This full-year high school course (1 credit) teaches students to eva...
Pre-K Skill-Building Set,https://timberdoodle.com/products/prek-skill-building-set,Timberdoodle,Pre-K; Preschool,$0.00-$20.75,"Build essential preschool skills with Timberdoodle’s Pre-K Skill-Building Set! Featuring sticker-packed fun and hands-on challenges, it’s the perfect ho..."
Primary Science Set,https://timberdoodle.com/products/primary-science-set-by-learning-resources,Timberdoodle,,$0.00-$39.99,"The Primary Science Kit includes ten real, kid-sized lab tools and experiment cards to spark hands-on STEM learning in preschoolers—no mess, all fun!"
Prime Suspect - Campground - 4 Sets,https://timberdoodle.com/products/prime-suspect-campground-4-sets,Timberdoodle,,$0.00-$47.95,"Four copies of the same deduction game—so the whole family can race to crack the case. 45 puzzles each, from beginner to expert."
Prime Suspect: At the Campground,https://timberdoodle.com/products/prime-suspect-at-the-campground,Timberdoodle,,$0.00-$14.99,Campground clues and 45 cases that grow steadily trickier. A compact logic game that sharpens deductive reasoning—perfect for on-the-go play.
Prime Suspect: At the Ski Resort,https://timberdoodle.com/products/prime-suspect-at-the-ski-resort,Timberdoodle,,$0.00-$14.99,"Quirky suspects, snowy clues, and 45 cases to solve. This portable deduction game builds logical thinking your child can take anywhere."
Prime Suspect: In the City,https://timberdoodle.com/products/prime-suspect-in-the-city,Timberdoodle,,$0.00-$14.99,"City clues, new suspects, and 45 fresh cases to crack. This compact logic game builds deductive reasoning one puzzle at a time."
Puzzleball Globe - 180 pc,https://timberdoodle.com/products/childrens-world-globe-puzzle-180-pc,Timberdoodle,,$0.00-$34.99,"Build a 3D world map while boosting geography, logic, and fine motor skills! With 180 click-together curved pieces, Puzzleball Globe is a fun, brainy ad..."
Quarto Mini,https://timberdoodle.com/products/quarto-mini,Timberdoodle,,$0.00-$25.99,"Quarto Mini is a compact, brain-boosting strategy game that challenges players to line up four pieces with shared traits—but with a twist: your opponent..."
Quixo,https://timberdoodle.com/products/quixo,Timberdoodle,,$0.00-$39.99,"Quixo is a fast-moving, brain-boosting strategy game that’s like tic-tac-toe—only better! With sleek wooden pieces and an easy-to-learn yet challenging ..."
Rainbow Whirls,https://timberdoodle.com/products/rainbow-whirls,Timberdoodle,,$0.00-$49.99,Rainbow Whirls turns fine-motor practice into fun with colorful stacking and balancing activities. This heirloom-quality wooden toy helps toddlers devel...
Reading Challenge — 1 Year Access,https://timberdoodle.com/products/reading-challenge-1-year-access,Timberdoodle,,$49.00,"A year of curated, handbook-aligned reading challenges for the whole family—one purchase covers every reader. Try Read Around the World free first."
Reading Games with Ziggy the Zebra,https://timberdoodle.com/products/reading-games-with-ziggy-the-zebra,Timberdoodle,,$0.00-$20.95,Reading Games with Ziggy the Zebra is a supplemental product that can be used with All About Reading Level 1. This full-color book with perforated pages...
Real Science-4-Kids Book 1,https://timberdoodle.com/products/real-science-4-kids-book-1,Timberdoodle,,$0.00-$141.00,"Real Science-4-Kids lays a strong science foundation with clear, engaging lessons—making real science accessible and exciting, without the pressure of r..."
Real Science-4-Kids Book 2,https://timberdoodle.com/products/real-science-4-kids-book-2,Timberdoodle,,$0.00-$141.00,"Dive into hands-on learning with Real Science-4-Kids: Book 2, the perfect science curriculum for homeschoolers. Introduce your child to essential scient..."
Real Science-4-Kids Book 3,https://timberdoodle.com/products/real-science-4-kids-book-3,Timberdoodle,,$0.00-$141.00,"Empower your child with Real Science-4-Kids: Book 3, where science comes to life! This engaging curriculum helps homeschoolers apply scientific concepts..."
Real Science-4-Kids Book 4,https://timberdoodle.com/products/real-science-4-kids-book-4,Timberdoodle,,$0.00-$141.00,"Unlock your child's curiosity with Real Science-4-Kids: Book 4! Perfect for homeschoolers, this book dives deeper into scientific exploration, encouragi..."
Real Science-4-Kids Book 5,https://timberdoodle.com/products/real-science-4-kids-book-5,Timberdoodle,,$0.00-$141.00,"Challenge your child’s thinking with Real Science-4-Kids: Book 5! Perfect for homeschoolers, this book dives into the philosophy of science, helping stu..."
Real Science-4-Kids Book 6,https://timberdoodle.com/products/real-science-4-kids-book-6,Timberdoodle,,$0.00-$144.00,"Discover how technology powers scientific exploration in Real Science-4-Kids: Book 6! From microscopes to satellites, this homeschool-friendly curriculu..."
Real Science-4-Kids Book 7,https://timberdoodle.com/products/real-science-4-kids-book-7,Timberdoodle,,$0.00-$172.00,Help your child see the power of science in everyday life with Real Science-4-Kids: Book 7. This homeschool-friendly curriculum shows how scientific kno...
Roadworthy DVD,https://timberdoodle.com/products/roadworthy-dvd,Timberdoodle,,$0.00-$49.00,"Roadworthy is your go-to driver safety course for teens, offering essential, real-world instruction taught by crash investigator Mike Pehl. This DVD cov..."
Romi Rami,https://timberdoodle.com/products/romi-rami,Timberdoodle,,$5.00,Manufacturer's InformationManufacturer: Hachette Boardgames USA Inc Made By: Randolph GamesCreated By: Antoine LefebvreAge Recommendation: 8+ Grade Reco...
Science in the Age of Reason,https://timberdoodle.com/products/science-in-the-age-of-reason-set,Timberdoodle,,$0.00-$73.95,"Science in the Age of Reason covers scientific developments from the early 1700s to the early 1800s. Along the way, your student will learn about scient..."
Science in the Ancient World,https://timberdoodle.com/products/science-in-the-ancient-world-set,Timberdoodle,,$0.00-$73.95,Science in the Ancient World covers the work of natural philosophers who lived from about 600 BC to the early 1500s AD. It concentrates mostly on what t...
Science in the Atomic Age,https://timberdoodle.com/products/science-in-the-atomic-age-set-1,Timberdoodle,,$0.00-$113.95,"Berean Science offers students an opportunity to study science through the lens of history. Using a narrative dialogue and a Christian worldview, Berean..."
Science in the Beginning,https://timberdoodle.com/products/science-in-the-beginning-set,Timberdoodle,,$0.00-$73.95,"The Berean Science series teaches science as discovered throughout history, so it makes perfect sense for the series to open right at the beginning with..."
Science in the Industrial Age,https://timberdoodle.com/products/science-in-the-industrial-age-set,Timberdoodle,,$0.00-$73.95,"Science in the Industrial Age discusses scientific advances, discoveries, inventions, and even errors from the early 1800s to the early 1900s. Students ..."
Science in the Scientific Revolution,https://timberdoodle.com/products/science-in-the-scientific-revolution-set,Timberdoodle,,$0.00-$73.95,Science in the Scientific Revolution covers scientific developments from 1543 to the end of the 1600s. Students will see that most of the great natural...
Science Lessons and Investigations - Grade 1,https://timberdoodle.com/products/science-lessons-and-investigations-grade-1,Timberdoodle,Grade 1,$0.00-$23.99,"Build your first grader’s understanding of physical, life, and earth science with this full-color activity book! Engaging reading selections, activities..."
Science Lessons and Investigations - Grade 2,https://timberdoodle.com/products/science-lessons-and-investigations-grade-2,Timberdoodle,Grade 2,$0.00-$23.99,"Science Lessons and Investigations presents science learning through in-depth investigation and observation, supporting Next Generation Science Standard..."
Science Lessons and Investigations - Grade 3,https://timberdoodle.com/products/science-lessons-and-investigations-grade-3,Timberdoodle,Grade 3,$0.00-$23.99,"Build your first grader’s understanding of physical, life, and earth science with this full-color activity book! Engaging reading selections, activities..."
Science Lessons and Investigations - Grade 4,https://timberdoodle.com/products/science-lessons-and-investigations-grade-4,Timberdoodle,Grade 4,$0.00-$23.99,Inspire students to explore real-world science topics with Science Lessons and Investigations! The 13 robust science units present important science con...
Science Lessons and Investigations - Grade 5,https://timberdoodle.com/products/science-lessons-and-investigations-grade-5,Timberdoodle,Grade 5,$0.00-$23.99,Inspire students to explore real-world science topics with Science Lessons and Investigations! The 14 robust science units present important science con...
Science Lessons and Investigations - Grade 6,https://timberdoodle.com/products/science-lessons-and-investigations-grade-6,Timberdoodle,Grade 6,$0.00-$23.99,Inspire students to explore real-world science topics with Science Lessons and Investigations! The 14 robust science units present important science con...
Sculpd Pottery Kit for Kids,https://timberdoodle.com/products/sculpd-pottery-kit-for-kids,Timberdoodle,,$0.00-$65.00,"Real clay, real tools, and step-by-step projects your child shapes, paints, and keeps. An all-in-one pottery kit—no kiln needed."
Sculpd Ultimate Mosaic Kit,https://timberdoodle.com/products/sculpd-ultimate-mosaic-kit,Timberdoodle,,$0.00-$65.00,"Peel, place, and reveal a shimmering mosaic pot, mirror, and coaster. An all-in-one art kit your child finishes—and actually wants to display."
Sea Turtle Soapstone Carving Kit,https://timberdoodle.com/products/sea-turtle-soapstone-carving-kit,Timberdoodle,,$0.00-$31.99,"Real stone, real tools, and a sea turtle that takes shape as your child carves, files, and polishes. A hands-on art project with lasting results."
Seashell Shore 3D Painting,https://timberdoodle.com/products/seashell-shore-3d-painting,Timberdoodle,,$0.00-$24.99,"Press clay onto canvas to build a textured seashell scene that air-dries into lasting wall art. A calming, screen-free creative project."
Seaside,https://timberdoodle.com/products/seaside,Timberdoodle,,$0.00-$29.99,"Seaside A strategy game that can handle sand, wind, and real travel? The Seaside Game packs everything into a screen-printed canvas bag—70 wooden tokens..."
Seaside Watercolor Bundle,https://timberdoodle.com/products/seaside-watercolor-bundle,Timberdoodle,,$0.00-$55.75,"Watercolor painting can feel intimidating, but the Seaside Watercolor Workbook makes it approachable and fun! With step-by-step guidance, your teen will..."
Second Grade Thinking Skills \u0026 Key Concepts,https://timberdoodle.com/products/second-grade-thinking-skills-key-concepts,Timberdoodle,,$0.00-$21.99,"Puzzles and problems that won't let your child guess their way through. Builds real reasoning, logic, and analytical thinking for second graders."
See-Saw,https://timberdoodle.com/products/see-saw,Timberdoodle,,$0.00-$12.99,Spend time with your toddler exploring this delightful book of nursery songs. Here you’ll find many well-known songs for every occasion in a young child...
"SEEK, FIND, FUN! Animals",https://timberdoodle.com/products/seek-find-fun-animals,Timberdoodle,,$0.00-$10.99,"SEEK, FIND, FUN! Animals is a playful homeschool activity book full of stickers, search-and-find fun, and fascinating animal facts. It’s perfect for bui..."
Sensory Art 3D Painting - Koi Carp,https://timberdoodle.com/products/sensory-art-3d-painting-koi-carp,Timberdoodle,,$0.00-$29.99,Unlock your teen’s artistic potential with Sensory Art: Koi Carp. This 3D clay painting kit lets teens create a stunning koi masterpiece while building ...
Shape Makers,https://timberdoodle.com/products/shape-makers,Timberdoodle,,$0.00-$59.99,"Study a flat picture, then stack wooden pieces to rebuild it in 3D. Shape Makers trains spatial thinking through 24 challenges that grow with your child."
Shipping Protection,https://timberdoodle.com/products/navidium-shipping-protection,Timberdoodle,,$0.75-$74.25,
Simply Draw with Bob Parsons,https://timberdoodle.com/products/simply-draw-with-bob-parsons,Timberdoodle,,$0.00-$64.99,"Transform doodles into real drawings with Bob Parsons’ step-by-step art course. Includes nearly 200 pages, video lessons, and printable extras—perfect f..."
Sing the Bible,https://timberdoodle.com/products/sing-the-bible,Timberdoodle,,$0.00-$19.99,"Eric’s Greatest Race is a dynamic graphic novel packed with history, heroism, and heart. Eric Liddell is a real-life superhero with sneakers instead of ..."
Sing the Word from A to Z - Download,https://timberdoodle.com/products/sing-the-word-from-a-to-z-download,Timberdoodle,,$9.95,"Twenty-six Bible verses become joyful, unforgettable songs—one for every letter of the alphabet—help children learn Scripture effortlessly in MP3 downlo..."
Sing the Word: A New Commandment - Download,https://timberdoodle.com/products/sing-the-word-a-new-commandment-download,Timberdoodle,,$9.95,Nineteen word-for-word Bible verses get remixed into catchy songs your kids will belt out on repeat—planting truth in their hearts before they even know...
Sing the Word: All Nations Shall Worship - Download,https://timberdoodle.com/products/sing-the-word-all-nations-shall-worship,Timberdoodle,,$9.95,"This global Scripture album in MP3 download format turns Bible memory into a sing-along adventure, blending world instruments, family vocals, and word-f..."
Sing the Word: Credo (I Believe) - Download,https://timberdoodle.com/products/sing-the-word-credo-i-believe-download,Timberdoodle,,$9.95,"Credo (I Believe) helps kids joyfully sing Scripture into memory, turning songs into lasting truths they’ll carry for life, in MP3 download format."
Sing the Word: God Our Provider - Download,https://timberdoodle.com/products/sing-the-word-god-our-provider-download,Timberdoodle,,$9.95,"Scripture meets soundtrack with word-for-word Bible songs that easily weave into family life in MP3 download format. From Psalms to promises, each verse..."
Sing the Word: Great in Counsel \u0026 Mighty in Deed - Download,https://timberdoodle.com/products/sing-the-word-great-in-counsel-mighty-in-deed-download,Timberdoodle,,$9.95,"Turn Scripture into sing-along moments with 15 word-for-word Bible songs in MP3 download format that build faith, boost memory, and fill your home with ..."
Sing the Word: The Heavens Declare - Download,https://timberdoodle.com/products/sing-the-word-the-heavens-declare-download,Timberdoodle,,$9.95,"Twelve Scripture songs turn Bible verses into catchy, powerful melodies for daily life, building memory, faith, vocabulary, and confidence while keeping..."
Sketching Made Easy: Drawing Fundamentals for Beginners,https://timberdoodle.com/products/sketching-made-easy-drawing-fundamentals-for-beginners,Timberdoodle,,$0.00-$29.00,"Self-paced and kid-friendly, Sketching Made Easy teaches real drawing skills through short videos and printable worksheets. A fun, flexible art course y..."
Skill Sharpeners Geography - Grade 1,https://timberdoodle.com/products/skill-sharpeners-geography-grade-1,Timberdoodle,Grade 1,$0.00-$10.99,"Make geography fun and easy with Skill Sharpeners Grade 1—ideal for homeschoolers! Explore continents, landforms, and habitats with no prep required."
Skill Sharpeners Geography - Grade 2,https://timberdoodle.com/products/skill-sharpeners-geography-grade-2,Timberdoodle,Grade 2; 2Nd Grade,$0.00-$10.99,"Make geography fun with hands-on, standards-aligned activities for 2nd grade! Explore weather, cultures, regions \u0026 more while building reading and criti..."
Skill Sharpeners Geography - Grade 3,https://timberdoodle.com/products/skill-sharpeners-geography-grade-3,Timberdoodle,Grade 3; 3Rd Grade,$0.00-$10.99,"Explore volcanoes, explorers, and more with this engaging 3rd grade geography workbook! Packed with fun, standards-aligned activities that build reading..."
Skill Sharpeners Geography - Grade 4,https://timberdoodle.com/products/skill-sharpeners-geography-grade-4,Timberdoodle,Grade 4; 4Th Grade,$0.00-$10.99,"Explore Earth’s wonders—from time zones to ancient Rome—with this 4th grade geography workbook! Fun, standards-aligned activities build reading, writing..."
Skill Sharpeners Geography - Grade 5,https://timberdoodle.com/products/skill-sharpeners-geography-grade-5,Timberdoodle,Grade 5,$0.00-$10.99,"Explore world geography with Skill Sharpeners Grade 5! This fun, standards-based workbook helps homeschoolers investigate landforms, cultures, maps, and..."
Skill Sharpeners Geography - Grade 6,https://timberdoodle.com/products/skill-sharpeners-geography-grade-6,Timberdoodle,Grade 6,$0.00-$10.99,"Turn geography into an adventure with Skill Sharpeners Grade 6! This engaging homeschool workbook explores volcanoes, ecosystems, world cultures, and mo..."
Skill Sharpeners Geography - Grade K,https://timberdoodle.com/products/skill-sharpeners-geography-grade-k,Timberdoodle,K,$0.00-$10.99,"Explore continents, oceans, and landforms with colorful, hands-on geography for kindergartners! Cross-curricular, standards-aligned, and no prep require..."
Skill Sharpeners Science - Grade K,https://timberdoodle.com/products/skill-sharpeners-science-grade-k,Timberdoodle,K,$0.00-$10.99,"Introduce your kindergartner to science with fun, hands-on activities, rhymes, and real photos! Covers magnets, weather, life cycles, and more—aligned w..."
Smart Cookies,https://timberdoodle.com/products/smart-cookies,Timberdoodle,Ages 6,$0.00-$29.99,"Smart Cookies is a screen-free puzzle game that builds logic and reasoning with 64 clever challenges. Tasty fun for ages 6+, perfect for homeschool!"
Smart Dog Game,https://timberdoodle.com/products/smart-dog-game,Timberdoodle,,$0.00-$19.99,"Guide a clever corgi through 60 obstacle challenges using logic and strategy! Smart Dog is a screen-free, brain-boosting puzzle game that makes critical..."
Smart Farmer,https://timberdoodle.com/products/smart-farmer,Timberdoodle,,$0.00-$27.99,"Tame the chaos with Smart Farmer, a charming logic game where kids separate animals using just 3 fences. With 60 challenges, it builds spatial skills, l..."
Smart Start Beginning Coding - Grade 1,https://timberdoodle.com/products/smart-start-beginning-coding-grade-1,Timberdoodle,Grade 1,$0.00-$10.99,"Teach coding without screens! Smart Start Beginning Coding Grade 1 uses stories and puzzles to build logic, sequencing, and problem-solving for homescho..."
SmartMax  Extension - 6 Curved Bars,https://timberdoodle.com/products/smartmax-extension-6-curved-bars,Timberdoodle,,$6.00,SmartMax Extension - 6 Curved Bars is a multifaceted magnetic construction kits that include exceptionally powerful magnets permanently encapsulated in...
SmartMax My First People,https://timberdoodle.com/products/smartmax-my-first-people,Timberdoodle,Ages 1-5,$11.00,"SmartMax My First People Spark your child's curiosity with SmartMax My First People! This engaging STEM toy, designed for ages 1-5, lets kids explore ma..."
Sneak-a-Peek Science Collection,https://timberdoodle.com/products/sneak-a-peek-science-collection,Timberdoodle,,$0.00-$42.99,"Peek-through windows and bold illustrations turn every page into a guessing game that builds observation, prediction, and early science thinking."
Soapstone Carving Kits,https://timberdoodle.com/products/soapstone-carving-kits,Timberdoodle,,$0.00-$31.99,"Specially designed for hands-on learning, the Studiostone Creative Soapstone Carving Kit introduces your child to the centuries-old art of stone carving..."
Social Skills Activities for Ages 6-7,https://timberdoodle.com/products/social-skills-activities-for-ages-6-7,Timberdoodle,Ages 6-7,$0.00-$11.99,"Help your child build confidence, kindness, and conversation skills with this engaging social skills workbook. Perfect for homeschoolers and everyday life!"
Social Skills Activities for Ages 8-9,https://timberdoodle.com/products/social-skills-activities-for-ages-8-9,Timberdoodle,Ages 8-9,$0.00-$11.99,"Help your child build confidence, kindness, and real-life social smarts with 75 engaging activities. Includes online safety tips, conversation starters,..."
Solenoid Engine Deluxe Kit,https://timberdoodle.com/products/solenoid-engine-deluxe-kit,Timberdoodle,,$0.00-$149.90,"439 precision parts, step-by-step assembly, and a finished engine that actually runs. A serious build for students who want to understand how engines work."
Speech and Social Emotional Kit,https://timberdoodle.com/products/speech-and-social-emotional-kit,Timberdoodle,K,$212.00,"With illustrated scenes, sequencing cards, and interactive games, this kit helps kids build speech, sequencing, and empathy—teaching communication and k..."
Spelling You See - Level A,https://timberdoodle.com/products/spelling-you-see-level-a,Timberdoodle,,$0.00-$46.70,"Spelling You See: Level A makes learning to spell fun and stress-free! With short, daily lessons that build skills step-by-step, this program introduces..."
Spelling You See - Level B,https://timberdoodle.com/products/spelling-you-see-level-b,Timberdoodle,,$0.00-$72.70,"Spelling You See Level B: Jack and Jill uses rhymes and visuals to teach spelling naturally—no tests or word lists, just 10–15 minutes a day"
Spelling You See - Level C,https://timberdoodle.com/products/spelling-you-see-level-c,Timberdoodle,,$0.00-$72.70,"Spelling You See: Level C – Wild Tales makes spelling fun and stress-free! With creative, short daily lessons, your child will master tricky letter patt..."
Spelling You See - Level D,https://timberdoodle.com/products/spelling-you-see-level-d,Timberdoodle,,$0.00-$72.70,"Spelling You See: Level D – Americana teaches spelling through the power of storytelling! Perfect for fluent readers, this program uses real nonfiction ..."
Spelling You See - Level E,https://timberdoodle.com/products/spelling-you-see-level-e,Timberdoodle,,$0.00-$72.70,Spelling You See: Level E – American Spirit blends spelling practice with inspiring stories from American history! This multisensory program helps your ...
Spelling You See - Level F,https://timberdoodle.com/products/spelling-you-see-level-f,Timberdoodle,,$0.00-$72.70,Spelling You See: Level F – Ancient Achievements brings the wonders of the ancient world to life while teaching spelling naturally. Through engaging non...
Spelling You See - Level G,https://timberdoodle.com/products/spelling-you-see-level-g,Timberdoodle,,$0.00-$72.70,"Spelling You See: Level G – Modern Milestones blends rich, real-world content with advanced spelling techniques. Through fascinating nonfiction passages..."
Spin and Pop Leopard,https://timberdoodle.com/products/spin-pop-leopard,Timberdoodle,,$0.00-$7.99,"Spin and Pop Leopard Keep little hands busy and curious with this animal-themed sensory spinner. A gentle tap sets the leafy petals spinning, creating a..."
Spintronics Act 1,https://timberdoodle.com/products/spintronics-act-1,Timberdoodle,,$0.00-$83.55,"Bring electronics to life—no screens or equations! With Spintronics, teens build real mechanical circuits while learning voltage, current, and logic thr..."
Spruce Tree Carving Kit,https://timberdoodle.com/products/beavercraft-spruce-tree,Timberdoodle,,$0.00-$24.95,"Teach your teen craftsmanship and entrepreneurship with this hands-on woodcarving kit. Includes pro-grade tools, step-by-step video, and real business p..."
Stabilo Woody 3-in-1 18-Piece Set,https://timberdoodle.com/products/stabilo-woody-3-in-1-18-piece-set,Timberdoodle,,$0.00-$78.00,"Unleash colorful creativity with Stabilo Woody 3-in-1 pencils—ideal for homeschoolers! Part crayon, part pencil, part watercolor, these chunky sticks he..."
Stacking Rocket,https://timberdoodle.com/products/plantoys-stacking-rocket,Timberdoodle,,$0.00-$29.99,"Blast off into learning with PlanToys Stacking Rocket! This fun, sustainable toy combines shape-matching puzzles, stacking challenges, and an adorable a..."
Stages: Blocks,https://timberdoodle.com/products/stages-blocks,Timberdoodle,,$0.00-$99.99,"Unlock your child’s potential with Stages: Blocks! This set of 40 bright wooden blocks and 120 challenge cards takes block play to the next level, helpi..."
